### DISCUSSION TITLE
Cannot see any flows in Akvorado GUI after several days of troubleshooting

### DISCUSSION THREAD

**Discussion by userroot32** [akvorado/akvorado#1923] [Q&A]
**Body:**

Hello everyone,

I’ve been trying to set up Akvorado for a few days, but unfortunately I cannot see any flows in the GUI, even though I think I’ve followed all the documentation carefully. I would like to explain in detail what I have done so far and ask for advice on what else I should check to confirm that everything is working correctly.

### Installation method

* Environment: Ubuntu 22.04 (running on VMware Workstation).
* Deployment method: `docker-compose` using the default `docker-compose.yml` provided by the repository.
* Services running: `akvorado-inlet`, `akvorado-orchestrator`, `clickhouse`, `console`, `redis`, `zookeeper`, `kafka`, `traefik`.

### What I have done

 **Configured inlet ports**:
   In my `docker-compose.yml` I exposed the following ports for the inlet:

   ```yaml
   ports:
     - 4739:4739/udp   # IPFIX
     - 2055:2055/udp   # NetFlow v9 (Cisco IOSv)
     - 6343:6343/udp   # sFlow
   ```

 **Verified packet arrival**:
   Using `tcpdump` on the host I can see NetFlow/IPFIX packets arriving on port 4739 and 2055.

   ```
   sudo tcpdump -ni any udp port 4739 or udp port 2055
   ```

   → Packets are captured successfully.

**Checked listening sockets**:

   ```
   sudo ss -lunp | egrep '4739|2055'
   ```

   After editing `docker-compose.yml` and restarting, I can confirm the inlet is listening on these ports.

 **Configured exporter (Cisco IOSv)**:
   Example configuration:

   ```
   ip flow-export destination <AKVORADO_IP> 4739
   ip flow-export version 9
   ip route-cache flow
   ```

   The router shows that flows are exported and counters are increasing:

   ```
   show ip flow export
   show ip cache flow
   ```

 **ClickHouse verification**:
   I connected to the ClickHouse client:

   ```
   docker exec -it akvorado-clickhouse-1 clickhouse-client
   ```

   Then I ran:

   ```
   SELECT count() FROM default.flows_1m0s;
   ```

   → It always returns 0.
   Also, `SHOW TABLES FROM default;` shows some tables, but I had to manually run:

   ```
   curl -s http://akvorado-orchestrator:8080/api/v0/orchestrator/clickhouse/init.sh | bash
   ```

   inside the ClickHouse container to initialize.

**GUI**:
   When I open the console (via Traefik on port 8081), the GUI loads, but I don’t see any flows or exporters.

### Additional context

At this stage I am just running **small lab tests** with Cisco IOSv, because in the future I would like to integrate Akvorado into a production environment.
I have **never worked with NetFlow before**, so this is also a learning project for me to understand how NetFlow/IPFIX works and how to validate ingestion end to end.

### My questions

* What are the **key checks** I should perform to ensure that Akvorado is actually ingesting and processing flows (from inlet → Kafka → orchestrator → ClickHouse → console)?
* How can I confirm that the **inlet is parsing flows correctly** (not just receiving UDP packets)?
* Is there a way to check logs or metrics to confirm whether the flows are successfully inserted into ClickHouse?
* Could there be a compatibility issue between Cisco IOSv NetFlow v9 and Akvorado?
* Do I need to configure IPFIX specifically, or should NetFlow v9 work out of the box?

### Goal

I really want to learn how to debug the full chain (inlet → orchestrator → ClickHouse → GUI). I’ve been trying for days, and I feel I’m missing the correct tests to validate each step. Any guidance on **what to verify, where to look, and how to confirm ingestion** would be greatly appreciated.

Thank you in advance for your help!

**Comment by vincentbernat** [comment]
In the GUI, check the documentation and the troubleshooting section.

You did add 4739 for IPFIX, but you can also use 2055 (IPFIX/Netflow can be handled by the same port). Otherwise, did you modify the inlet configuration to add a listener for 4739? You need to duplicate the one for 2055. Your `ss` command shows that docker is listening, but it does not mean that akvorado is listening. You can check with `nsenter -t $(pgrep -fo "akvorado inlet") -n ss -lunp`.

**Reply by userroot32** [reply]
Hi @vincentbernat I have started from scratch again.

I’m testing Akvorado **v2.0.0-beta.5** on a clean Ubuntu 22.04 VM (VMware Workstation, bridged).
With the **default** `config/outlet.yaml` the stack is healthy and the web UI works.
As soon as I add **custom `interface-classifiers` rules** (very small changes), the **orchestrator becomes unhealthy** and the **console/outlet** keep restarting. Logs report a **YAML parse error** inside `outlet.yaml`.

I suspect I’m either missing a new v2 syntax detail for the classifier expressions or there’s a strict YAML parsing rule I’m violating (block scalars, quoting, etc.). I read the v2 quickstart and tried multiple variants (operators `matches` vs `=~`, IPv4 vs IPv6 in SNMP credentials, quoting) with the same result.

### Environment

* **Akvorado**: `v2.0.0-beta.5` (release tarball: `docker-compose-quickstart.tar.gz`)
* **Host OS**: Ubuntu Server 22.04 (VMware Workstation, bridged NIC)
* **Docker**:

  * `Docker Engine: 27.x` (standard apt install)
  * `docker compose version`: v2.x (plugin)
* **Hardware**: 8 vCPU, 16 GB RAM, \~150 GB disk
* **Network exporters** (for later testing): FortiGate VM (NetFlow v9), Cisco IOSv (Flexible NetFlow)

### What works (baseline)

If I leave `config/outlet.yaml` **exactly as shipped**, everything goes healthy:

```yaml
---
metadata:
  provider:
    type: snmp
    credentials:
      ::/0:
        communities: public

routing:
  provider:
    type: bmp
    receive-buffer: 212992

core:
  exporter-classifiers:
    - ClassifySiteRegex(Exporter.Name, "^([^-]+)-", "$1")
    - ClassifyRegion("europe")
    - ClassifyTenant("acme")
    - ClassifyRole("edge")

  interface-classifiers:
    - |
      ClassifyConnectivityRegex(Interface.Description, "^(?i)(transit|pni|ppni|ix):? ", "$1") &&
      ClassifyProviderRegex(Interface.Description, "^\\S+?\\s(\\S+)", "$1") &&
      ClassifyExternal()
    - ClassifyInternal()
```

**Result:**

```
docker compose up -d --wait
docker compose ps
# clickhouse/kafka/redis/geoip/traefik: healthy
# akvorado-orchestrator: healthy
# akvorado-console: healthy
# akvorado-outlet: healthy
```

### What fails (minimal reproducible change)

If I only **add two rules by interface name** (WAN/LAN) before the fallback, the orchestrator becomes **unhealthy** and `console/outlet` restart. Here is the **full** `config/outlet.yaml` that fails:

```yaml
---
metadata:
  provider:
    type: snmp
    credentials:
      "0.0.0.0/0":          # also tried "::/0" quoted
        communities: public

routing:
  provider:
    type: bmp
    receive-buffer: 212992

core:
  exporter-classifiers:
    - ClassifySiteRegex(Exporter.Name, "^([^-]+)-", "$1")
    - ClassifyRegion("europe")
    - ClassifyTenant("acme")
    - ClassifyRole("edge")

  interface-classifiers:
    # default rule by Description (works as-is)
    - |
      ClassifyConnectivityRegex(Interface.Description, "^(?i)(transit|pni|ppni|ix):? ", "$1") &&
      ClassifyProviderRegex(Interface.Description, "^\\S+?\\s(\\S+)", "$1") &&
      ClassifyExternal()

    # added: by interface Name (WAN on FG/IOSv)
    - |
      (Interface.Name =~ "(?i)(wan|port1|GigabitEthernet0/0)") &&
      ClassifyExternal() &&
      ClassifyConnectivity("transit") &&
      ClassifyProvider("ISP-Lab")

    # added: by interface Name (LAN on FG/IOSv)
    - |
      (Interface.Name =~ "(?i)(lan|internal|port2|GigabitEthernet0/1)") &&
      ClassifyInternal()

    # fallback
    - ClassifyInternal()
```

I also tried:

* Using `matches` instead of `=~`.
* Quoting the regex, escaping the slashes, removing comments.
* Keeping `::/0` (quoted) instead of `0.0.0.0/0`.
* Copy-pasting the default first, then **only** inserting the two `- |` blocks above.

Same outcome.

### Symptoms / Logs

**`docker compose ps`** shows orchestrator, outlet and console cycling:

```
akvorado-orchestrator-1  Restarting (1) ...
akvorado-outlet-1        Restarting (1) ...
akvorado-console-1       Restarting (1) ...
```

**Orchestrator logs** (repeats):

```
docker compose logs --tail=200 akvorado-orchestrator
Error: unable to parse YAML configuration file: at line 78 of akvorado.yaml:
in outlet.yaml: yaml: line 14: did not find expected key
```

When I revert to the **default** `outlet.yaml`, health is restored immediately.

I also ran:

```
docker compose exec akvorado-orchestrator \
  akvorado orchestrator --check /etc/akvorado/outlet.yaml
```

and got the same parse error pointing inside `outlet.yaml` (line numbers vary as I tweak).


### Steps to Reproduce

1. Fresh Ubuntu 22.04 VM (VMware bridged), install Docker & Compose.
2. `mkdir akvorado && cd akvorado`
3. Download v2.0.0-beta.5 quickstart:

   ```
   curl -sL https://github.com/akvorado/akvorado/releases/download/v2.0.0-beta.5/docker-compose-quickstart.tar.gz | tar zxvf -
   ```
4. **Baseline check** (default files):

   ```
   docker compose up -d --wait
   docker compose ps   # all healthy
   ```
5. Edit `config/outlet.yaml` and replace it with the **“failing”** version above (only adds two `interface-classifiers` blocks by Name).
6. Apply:

   ```
   docker compose up -d --wait --no-deps akvorado-orchestrator
   docker compose ps   # orchestrator unhealthy
   docker compose logs --tail=200 akvorado-orchestrator
   ```
7. Revert to default `outlet.yaml` → everything healthy again.


### What I expected

* Custom `interface-classifiers` (by interface **Name**) to be accepted exactly like the default rule (by **Description**), and the orchestrator to stay healthy.

### What actually happens

* Any addition of `- |` classifier blocks by **Name** causes the **YAML parse error** and the orchestrator turns **unhealthy**.


### Questions for maintainers

1. Is the **classifier expression** syntax shown above valid for **v2**?

   * Are both `=~` and `matches` supported for regex?
2. Are there **formatting constraints** for block scalars under `interface-classifiers` beyond standard YAML indentation (2 spaces) that we should follow?
3. Is there any **reserved character or token** inside the expression that now requires quoting (e.g., parentheses or `?i`)?
4. In v2, is there any difference in where `interface-classifiers` should be placed inside `outlet.yaml` compared to the default (I kept `metadata/routing/core` top-level as in the shipped file)?
5. Any known caveat with `credentials` keys like `"0.0.0.0/0"` vs `"::/0"` (quoted) in **v2**?


### Extra context

* I’m trying to classify **FortiGate VM** and **Cisco IOSv** where interface **Names** are typically `port1/port2` and `GigabitEthernet0/0–0/1`.
  Most devices don’t carry `Description` like `transit:` or `ix:` in my lab, so Name-based rules are ideal.

### References

* Release used: `v2.0.0-beta.5` (`docker-compose-quickstart.tar.gz`)
* Quickstart docs and config guide (v2)
* Commands used to validate:

  ```bash
  docker compose up -d --wait
  docker compose logs --tail=200 akvorado-orchestrator
  docker compose exec akvorado-orchestrator akvorado orchestrator --check /etc/akvorado/outlet.yaml
  ```

Thanks a lot for any guidance!

**Reply by vincentbernat** [reply]
You should use `matches` instead of `=~`. The language is defined here: https://expr-lang.org/docs/language-definition.

Other than that, the configuration file you provide seems to work. You can check it with:

```
docker compose run --rm --no-deps akvorado-orchestrator orchestrator --check /etc/akvorado/akvorado.yaml
```

Add `--dump` to inspect the result.

**Reply by userroot32** [reply]
Hi @vincentbernat Thanks you very much!!  You have reason **outlet.yaml parsing errors** caused by syntax issues in interface classifiers. That problem was successfully solved (I had mistakenly used `=~` instead of `matches`). Now the orchestrator and outlet start without YAML errors, SNMP works, and classifiers are applied correctly.

However, I have now run into a **new problem**: even though my Cisco IOSv is exporting NetFlow v9, the **Akvorado UI http://akvorado:8081 shows 0 flows and 0 exporters**.

Apologies in advance if I am misunderstanding something basic — in this kind of lab environment, and working with Docker/Akvorado, I’m still a beginner. I’m learning as I go, so any misconfiguration or wrong assumption is probably due to my inexperience. 

### What is working so far

* **SNMP connectivity** works and interface descriptions/names are retrieved correctly:

  ```bash
  snmpwalk -v2c -c public 192.168.1.18 1.3.6.1.2.1.2.2.1.2
  ```

  Output:

  ```
  IF-MIB::ifDescr.1 = STRING: GigabitEthernet0/0
  IF-MIB::ifDescr.2 = STRING: GigabitEthernet0/1
  IF-MIB::ifDescr.3 = STRING: GigabitEthernet0/2
  IF-MIB::ifDescr.4 = STRING: GigabitEthernet0/3
  IF-MIB::ifDescr.5 = STRING: Null0
  ```

* **Outlet.yaml classifier issue resolved.** Now Akvorado starts fine without config errors.

* Containers (`orchestrator`, `outlet`, `console`) run normally.


### Cisco IOSv Configuration

```none
flow exporter EXP_AKV
 description User defined
 destination 192.168.1.16
 source GigabitEthernet0/0
 transport udp 2055
 export-protocol netflow-v9
 template data timeout 60

flow monitor MON_NETFLOW
 record netflow-original
 exporter EXP_AKV
 cache timeout active 60
 cache timeout inactive 15

interface GigabitEthernet0/0
 ip address dhcp
 ip flow monitor MON_NETFLOW input
 ip flow monitor MON_NETFLOW output

interface GigabitEthernet0/1
 ip address 192.168.1.18 255.255.255.0
 ip flow monitor MON_NETFLOW input
 ip flow monitor MON_NETFLOW output
```

### Verification on IOSv

```
lab-edge-iosv01#show flow exporter
Flow Exporter EXP_AKV:
  Destination IP address: 192.168.1.16
  Source IP address:      192.168.1.18
  Transport Protocol:     UDP
  Destination Port:       2055
  Export protocol:        NetFlow Version 9

lab-edge-iosv01#show flow monitor MON_NETFLOW cache
Flows added: 26
Flows aged:  26
```

So the router is generating and aging flows correctly.

### Current problem

Even with flows being generated and exported, the Akvorado UI still shows:

* **0 flows/s**
* **0 exporters**
* No data in charts

always returns **0**.


### Question

What could I be missing to get flows from Cisco IOSv into Akvorado?

* Do I need to expose `2055/udp` explicitly in the `docker-compose.yml` for `akvorado-inlet`?
* Is there any known caveat with Cisco IOSv exporters and Akvorado?
* Should I check `flows_raw_errors` in ClickHouse to see if NetFlow packets are dropped or not parsed?

Any guidance would be greatly appreciated

**Reply by vincentbernat** [reply]
Check the [troubleshooting section](https://demo.akvorado.net/docs/troubleshooting) of the documentation to diagnose your issue.

**Reply by userroot32** [reply]
Hey @vincentbernat Sorry, I have been trying for more than a week to test Akvorado but I cannot get it working. I follow the troubleshooting section iam stuck!

1) UDP NetFlow reaches host and is bridged to container
sudo tcpdump -nni any host 192.168.1.21 and udp port 2055 -vv -c 20

20:27:11.090218 ens33 In  IP 192.168.1.21.62505 > 192.168.1.19.2055: UDP, length 64
20:27:11.090266 br-akvorado Out IP 192.168.1.21.62505 > 247.16.14.11.2055: UDP, length 64
20:27:11.090273 vethd9a2dc Out IP 192.168.1.21.62505 > 247.16.14.11.2055: UDP, length 64

2) Containers healthy and UDP port exposed
docker compose ps
...
akvorado-akvorado-inlet-1  Up (healthy)  0.0.0.0:2055->2055/udp, 0.0.0.0:4739->4739/udp, 0.0.0.0:6343->6343/udp, 8080/tcp
akvorado-traefik-1        Up            127.0.0.1:8080->8080/tcp
...

3) Inlet logs show UDP inputs and Kafka producer
docker compose logs --tail=100 akvorado-inlet
{"level":"info","message":"starting UDP input","listen":":2055"}
{"level":"info","message":"starting UDP input","listen":":4739"}
{"level":"info","message":"starting UDP input","listen":":6343"}
{"level":"info","module":"kafka","message":"producing to a new topic for the first time","topic":"flows-v5"}
{"level":"info","module":"kafka","message":"done waiting for metadata for topic"}
{"level":"info","module":"kafka","message":"initializing producer id"}

4) Traefik serves console endpoints, but inlet metrics is 502
curl -s http://127.0.0.1:8080/api/v0/inlet/metrics
Bad Gateway


Traefik access logs show many 200 responses for /api/v0/console/... routes at the same time.

Configuration
docker-compose.override.yml
services:
  akvorado-inlet:
    ports:
      - "2055:2055/udp"
      - "4739:4739/udp"
      - "6343:6343/udp"

config/inlet.yaml
flow:
  inputs:
    - type: udp
      decoder: netflow
      listen: :2055
      workers: 4
      use-src-addr-for-exporter-addr: true
kafka:
  compression-codec: zstd

config/outlet.yaml (the one I am currently using)
---
metadata:
  provider:
    type: snmp
    credentials:
      ::/0:
        communities: public
routing:
  provider:
    type: bmp
    # Before increasing this value, look for it in the troubleshooting section
    # of the documentation.
    receive-buffer: 212992
core:
  exporter-classifiers:
    - ClassifySiteRegex(Exporter.Name, "^([^-]+)-", "$1")
    - ClassifyRegion("europe")
    - ClassifyTenant("acme")
    - ClassifyRole("edge")

  interface-classifiers:
 
    - |
      ClassifyConnectivityRegex(Interface.Description, "^(?i)(transit|pni|ppni|ix):? ", "$1") &&
      ClassifyProviderRegex(Interface.Description, "^\\S+?\\s(\\S+)", "$1") &&
      ClassifyExternal()

    
    - |
      (Interface.Name matches "(?i)(wan|port1|GigabitEthernet0/0)") &&
      ClassifyExternal() &&
      ClassifyConnectivity("transit") &&
      ClassifyProvider("ISP-Lab")

   
    - |
      (Interface.Name matches "(?i)(lan|internal|port2|GigabitEthernet0/1)") &&
      ClassifyInternal()

    # Fallback
    - ClassifyInternal()

Cisco IOSv exporter (summary)
flow exporter EXP_AKV
 destination 192.168.1.19
 source GigabitEthernet0/0
 transport udp 2055
 export-protocol netflow-v9
 template data timeout 60

flow record REC_L3L4
 match ipv4 source address
 match ipv4 destination address
 match transport source-port
 match transport destination-port
 match ip protocol
 match interface input
 collect counter bytes long
 collect counter packets long
 collect timestamp sys-uptime first
 collect timestamp sys-uptime last

flow monitor MON_NETFLOW
 record REC_L3L4
 exporter EXP_AKV
 cache timeout active 60
 cache timeout inactive 15

interface GigabitEthernet0/0
 description transit: ISP-Lab
 ip address dhcp
 ip flow monitor MON_NETFLOW input
 ip flow monitor MON_NETFLOW output
 no shutdown

snmp-server community public RO ACL-SNMP-AKV
ip access-list standard ACL-SNMP-AKV
 permit 192.168.1.19
 deny any log

What I already fixed

Validation error on CacheRefresh earlier; now removed/zeroed.

Expr syntax error from using =~ instead of matches; rules now use matches.

Troubleshooting steps followed

Verified flow arrival with tcpdump on the host.

Confirmed 0.0.0.0:2055->2055/udp published and akvorado-inlet is healthy.

Checked inlet logs (UDP listeners started, Kafka topic created and producer initialized).

Validated YAML with akvorado orchestrator --check.

Tested metrics endpoints via Traefik (containers do not have curl/wget installed). Console endpoints respond 200; inlet metrics returns 502.

I can run suggested ClickHouse queries if needed; currently the UI remains at 0.

Questions

In the quickstart, should http://127.0.0.1:8080/api/v0/inlet/metrics be reachable through Traefik by default, similar to the console endpoints? If so, which labels/routers should I confirm for the inlet service?

Could inlet’s metrics route be misconfigured or disabled in v2.0.0-beta.5 quickstart while the service is healthy?

Given that UDP 2055 traffic definitively reaches the container bridge and inlet logs show listeners started, what else should I check to explain the “0 flows” in the UI? Is the 502 on the inlet metrics a known symptom of a specific misconfiguration?

Thanks in advance for any guidance.

**Comment by vincentbernat** [comment]
The issue with inlet metrics is not a problem on your side. Until this is fixed, get the container address with:

```
docker container inspect -f '{{range .NetworkSettings.Networks}}{{.IPAddress}}{{end}}' akvorado-akvorado-inlet-1
```

Then, replace `127.0.0.1` by this address to get the metrics and continue the troubleshooting documentation.
