### ISSUE TITLE
OutIf* not filled for subif

### ISSUE THREAD

**Issue by alarig** [akvorado/akvorado#370]
# If packet are transiting via a subif, OutIf* fields aren’t filled

## Steps to reproduce the problem

Use a subif

```
edge-1.sd4#show bgp ipv4 unicast 89.234.186.121
BGP routing table entry for 89.234.186.0/24
 Paths: 15 available
  34019 204092
    37.49.236.71 from 37.49.236.71 (193.17.192.130)
      Origin IGP, metric 200, localpref 100, IGP metric 0, weight 0, tag 0
      Received 14d15h ago, valid, external, ECMP head, ECMP, best, ECMP contributor, AS Origin valid
      Community: 29169:100 29169:50000 29169:51706 34019:20409 34019:64512
      Rx SAFI: Unicast
  30781 204092
    37.49.236.3 from 37.49.236.3 (193.151.85.40)
      Origin IGP, metric 200, localpref 100, IGP metric 0, weight 0, tag 0
      Received 6d17h ago, valid, external, ECMP, ECMP contributor, AS Origin valid
      Community: 29169:100 29169:50000 29169:51706 30781:22037 30781:33000 30781:40000 30781:65000 30781:65010
      Rx SAFI: Unicast
edge-1.sd4#show ip route 37.49.236.71 | grep directly
 C        37.49.236.0/22 is directly connected, Ethernet11/1.809
edge-1.sd4#show running-config interfaces Ethernet11/1.809 | grep desc
   description Peering: FRANCE-IX
edge-1.sd4#show snmp mib ifmib ifindex Ethernet11/1.809
Ethernet11/1.809: Ifindex = 1285816721
```

**Akvorado version**: v1.6.4

## Expected outcome

`OufIfName = Ethernet11/1.809` and `OutIfDescription = Peering: FRANCE-IX`

## Current outcome

Empty fields for France-IX, DE-CIX can be ignored, it’s plugged on a “classical“ Ethernet interface
![Screenshot 2022-12-28 at 14-02-12 Akvorado Visualize Stacked areas · OutIfName OutIfDescription · DstAddr 89 234 186 121 AND OutIfDescription UNLIKE Core % · December 28 2022 7 52 AM · 1 52 PM](https://user-images.githubusercontent.com/13120362/209816667-e0911627-80f0-44de-97af-646148a5c603.png)

**Comment by vincentbernat** [comment]
Most likely, the information is not here with SNMP. Can you check with either snmpwalk or show snmp?

**Comment by alarig** [comment]
I did an snmpwalk and the data are here. I can also see it in tcpdump from the VM hosting akvorado:
`.1.3.6.1.2.1.2.2.1.2.1285816721="Ethernet11/1.809" .1.3.6.1.2.1.31.1.1.1.18.1285816721="Peering: FRANCE-IX" .1.3.6.1.2.1.31.1.1.1.15.1285816721=0`

**Comment by vincentbernat** [comment]
OK, so maybe, the index is not set in Netflow (or set to the index of the parent interface). You can check that with tcpdump (and wireshark to filter on the destination address).

**Comment by alarig** [comment]
I used `sflow.flow_sample.output_interface_value == 1285816721` as a filter in wireshark and I have packets, the content corresponds to what we push on that interface.

**Comment by vincentbernat** [comment]
Try `select * from exporters where IfName = 'Ethernet11/1.809'` in ClickHouse.

**Comment by alarig** [comment]
I have four identical rows:
```
ecb22f0441ce :) select * from exporters where IfName = 'Ethernet11/1.809'

SELECT *
FROM exporters
WHERE IfName = 'Ethernet11/1.809'

Query id: ed230a94-c7df-4091-a561-3a17c0921146

┌────────TimeReceived─┬─ExporterAddress────────┬─ExporterName─────────────────┬─ExporterGroup─┬─ExporterRole─┬─ExporterSite─┬─ExporterRegion─┬─ExporterTenant─┬─IfName───────────┬─IfDescription──────┬─IfSpeed─┬─IfConnectivity─┬─IfProvider─┬─IfBoundary─┐
│ 2022-12-28 17:58:33 │ ::ffff:173.246.102.253 │ edge-1.sd4.blahblahblahb.net │               │ edge         │ edge         │ europe         │ acme           │ Ethernet11/1.809 │ Peering: FRANCE-IX │       0 │ peering        │ france-ix  │ external   │
└─────────────────────┴────────────────────────┴──────────────────────────────┴───────────────┴──────────────┴──────────────┴────────────────┴────────────────┴──────────────────┴────────────────────┴─────────┴────────────────┴────────────┴────────────┘
┌────────TimeReceived─┬─ExporterAddress────────┬─ExporterName─────────────────┬─ExporterGroup─┬─ExporterRole─┬─ExporterSite─┬─ExporterRegion─┬─ExporterTenant─┬─IfName───────────┬─IfDescription──────┬─IfSpeed─┬─IfConnectivity─┬─IfProvider─┬─IfBoundary─┐
│ 2022-12-28 17:58:33 │ ::ffff:173.246.102.253 │ edge-1.sd4.blahblahblahb.net │               │ edge         │ edge         │ europe         │ acme           │ Ethernet11/1.809 │ Peering: FRANCE-IX │       0 │ peering        │ france-ix  │ external   │
└─────────────────────┴────────────────────────┴──────────────────────────────┴───────────────┴──────────────┴──────────────┴────────────────┴────────────────┴──────────────────┴────────────────────┴─────────┴────────────────┴────────────┴────────────┘
┌────────TimeReceived─┬─ExporterAddress────────┬─ExporterName─────────────────┬─ExporterGroup─┬─ExporterRole─┬─ExporterSite─┬─ExporterRegion─┬─ExporterTenant─┬─IfName───────────┬─IfDescription──────┬─IfSpeed─┬─IfConnectivity─┬─IfProvider─┬─IfBoundary─┐
│ 2022-12-28 17:58:33 │ ::ffff:173.246.102.253 │ edge-1.sd4.blahblahblahb.net │               │ edge         │ edge         │ europe         │ acme           │ Ethernet11/1.809 │ Peering: FRANCE-IX │       0 │ peering        │ france-ix  │ external   │
└─────────────────────┴────────────────────────┴──────────────────────────────┴───────────────┴──────────────┴──────────────┴────────────────┴────────────────┴──────────────────┴────────────────────┴─────────┴────────────────┴────────────┴────────────┘
┌────────TimeReceived─┬─ExporterAddress────────┬─ExporterName─────────────────┬─ExporterGroup─┬─ExporterRole─┬─ExporterSite─┬─ExporterRegion─┬─ExporterTenant─┬─IfName───────────┬─IfDescription──────┬─IfSpeed─┬─IfConnectivity─┬─IfProvider─┬─IfBoundary─┐
│ 2022-12-28 17:58:33 │ ::ffff:173.246.102.253 │ edge-1.sd4.blahblahblahb.net │               │ edge         │ edge         │ europe         │ acme           │ Ethernet11/1.809 │ Peering: FRANCE-IX │       0 │ peering        │ france-ix  │ external   │
└─────────────────────┴────────────────────────┴──────────────────────────────┴───────────────┴──────────────┴──────────────┴────────────────┴────────────────┴──────────────────┴────────────────────┴─────────┴────────────────┴────────────┴────────────┘

4 rows in set. Elapsed: 0.010 sec. 

ecb22f0441ce :) 

```

**Comment by vincentbernat** [comment]
If it's here, it means there are packets matching. However, they may match inbound or outbound. Use `select * from flows where TimeReceived > now() - interval 10 minutes where OutIfName = 'Ethernet11/1.809' limit 2` to check if there exists outbound packets.

**Comment by alarig** [comment]
The InIf* fields are usable, only the OutIf* ones are empty. The query shows it:
```
ecb22f0441ce :) select * from flows where TimeReceived > now() - interval 10 MINUTE AND OutIfName = 'Ethernet11/1.809' limit 2

SELECT *
FROM flows
WHERE (TimeReceived > (now() - toIntervalMinute(10))) AND (OutIfName = 'Ethernet11/1.809')
LIMIT 2

Query id: 772fe5dd-c536-46ec-8a96-ed9d43ebd0a1

Ok.

0 rows in set. Elapsed: 0.023 sec. Processed 1.03 million rows, 1.11 MB (44.08 million rows/s., 47.18 MB/s.)

ecb22f0441ce :) select * from flows where TimeReceived > now() - interval 10 MINUTE AND InIfName = 'Ethernet11/1.809' limit 2

SELECT *
FROM flows
WHERE (TimeReceived > (now() - toIntervalMinute(10))) AND (InIfName = 'Ethernet11/1.809')
LIMIT 2

Query id: 3360c8ca-6b45-40ed-b8da-550da5bdbf2e

[results array here]

2 rows in set. Elapsed: 0.119 sec. Processed 32.77 thousand rows, 6.97 MB (276.51 thousand rows/s., 58.85 MB/s.)

ecb22f0441ce :) 

```

**Comment by vincentbernat** [comment]
It's odd it happens only for subinterfaces. Akvorado does nothing special. What about: `select * from flows where TimeReceived > now() - interval 10 MINUTE AND OutIfName LIKE '%.%' limit 2`?

**Comment by vincentbernat** [comment]
In the matched packet, in Wireshark, what's the output interface format?

**Comment by alarig** [comment]
The query doesn’t match any row.

Here is a flow for this interface:
```
Expanded flow sample, seq 2169607795
    0000 0000 0000 0000 0000 .... .... .... = Enterprise: standard sFlow (0)
    .... .... .... .... .... 0000 0000 0011 = sFlow sample type: Expanded flow sample (3)
    Sample length (byte): 284
    Sequence number: 2169607795
    Source ID type: 0
    Source ID index: 11001
    Sampling rate: 1 out of 1000 packets
    Sample pool: 649310520 total packets
    Dropped packets: 0
    Input interface format: 0
    Input interface value: 29001
    .000 0000 0000 0000 0000 0000 0000 0000 = Output interface format: 0
    Output interface value: 1285816721
    Flow record: 3
    Raw packet header
        0000 0000 0000 0000 0000 .... .... .... = Enterprise: standard sFlow (0)
        Format: Raw packet header (1)
        Flow data length (byte): 144
        Header protocol: Ethernet (1)
        Frame Length: 1522
        Payload removed: 4
        Original packet length: 128
        Header of sampled packet: 8ae0f34ff822948ed30a713b810003290800450805dc42a240003d066d902ee268ca22f5…
            Ethernet II, Src: AristaNe_0a:71:3b (94:8e:d3:0a:71:3b), Dst: 8a:e0:f3:4f:f8:22 (8a:e0:f3:4f:f8:22)
            802.1Q Virtual LAN, PRI: 0, DEI: 0, ID: 809
            Internet Protocol Version 4, Src: 46.226.104.202, Dst: 34.245.205.64
            Transmission Control Protocol, Src Port: 22, Dst Port: 9988, Seq: 2864102702, Ack: 2141677696
            SSH Protocol
    Extended gateway data
        0000 0000 0000 0000 0000 .... .... .... = Enterprise: standard sFlow (0)
        Format: Extended gateway data (1003)
        Flow data length (byte): 56
        Next hop: 37.49.236.118
        AS Router: 29169
        AS Source: 203476
        AS Peer: 203476
        AS Destinations: 1
        AS Sequence, (1 entries)
            AS Destination: 16509
        Gateway Communities: 3
        localpref: 100
    Extended router data
        0000 0000 0000 0000 0000 .... .... .... = Enterprise: standard sFlow (0)
        Format: Extended router data (1002)
        Flow data length (byte): 16
        Next hop: 37.49.236.118
        Next hop source mask: 22
        Next hop destination mask: 13
```

**Comment by vincentbernat** [comment]
1285816721 translates to 0x4ca40191. The two most significant bits are reserved to encode additional stuff (0 = single interface, 1 = packet discarded, 2 = multiple output interfaces). In your case, the packet is recorded as discarded and the interface is ignored.

However, I see that your Wireshark only considers the first bit. Could you share the whole packet in pcap format? Maybe there is some heuristics that could be applied.

**Comment by alarig** [comment]
Sure, it’s not the exact same packet as I closed wireshark in the meanwhile, but it should be OK.
https://herbizarre.swordarmor.fr/subif-sflow.pcap

(I’ll delete it once you downloaded it, just to avoid having packets in the wild :p)

**Comment by vincentbernat** [comment]
You can delete it. I'll look into Wireshark source code to understand how this works.

**Comment by alarig** [comment]
Thanks a lot :)

**Comment by vincentbernat** [comment]
sFlow is quite badly documented. Once the Docker image is built, you can try the `main` tag if you can. Please, check if you see `sflow packet has both regular and expanded flows` in the metrics.

BTW, is the sampling correct for you?

**Comment by alarig** [comment]
Thanks a lot! I confirm that I now have flows for the sub-interfaces :)
I don’t have `sflow packet has both regular and expanded flows` in the metrics. I have some regular flows, but a lot less than the extended ones.
```
~ % curl -s http://akvorado/api/v0/inlet/metrics | awk '/CounterSample/ { sum += $NF; } END { print sum; }'     
29127
~ % curl -s http://akvorado/api/v0/inlet/metrics | awk '/ExpandedFlowSample/ { sum += $NF; } END { print sum; }' 
5231712
~ % curl -s http://akvorado/api/v0/inlet/metrics | grep regular                                    
zsh: done       curl -s http://akvorado/api/v0/inlet/metrics | 
zsh: exit 1     grep --color=auto regular
~ % 
```

The flow sampling reported in the packets and in clickhouse is correct. And now that I have the traffic for subifs, the traffic levels are consistent with LibreNMS.
