### DISCUSSION TITLE
Metadata cache miss after upgrade from v2.0.1 to 2.0.4

### DISCUSSION THREAD

**Discussion by stereu** [akvorado/akvorado#2162] [Q&A] [answered]
Exporter: Juniper MX204 (JunOS)
Features used: SNMP, BMP, inline-jflow
Checks: snmpwalk returns correct values, tcpdump shows snmp responses
Possibly related: #2144 

```
# curl -s http://127.0.0.1:8080/api/v0/outlet/metrics | grep 'akvorado_outlet_core.*errors'
akvorado_outlet_core_flows_errors_total{error="metadata cache miss",exporter="x.x.x.x"} 869
```

```
# curl -s http://127.0.0.1:8080/api/v0/outlet/metrics | grep 'akvorado_outlet_metadata'

akvorado_outlet_metadata_cache_expired_entries_total 0
akvorado_outlet_metadata_cache_hits_total 3960
akvorado_outlet_metadata_cache_misses_total 0
akvorado_outlet_metadata_cache_refresh_runs_total 1
akvorado_outlet_metadata_cache_refreshes_total 0
akvorado_outlet_metadata_cache_size_entries 12
akvorado_outlet_metadata_provider_errors_total 0
akvorado_outlet_metadata_provider_requests_total 0
```

**Comment by vincentbernat** [comment]
2.0.4 should be more permissive than 2.0.1 in this aspect. Each flow should have at least one valid interface.

Can you provide the metrics for `core_received` and `core_forwarded` to check if some flows are OK or not?

What do the SNMP answers look like?

**Comment by stereu** [comment]
Thank you Vincent!

```
# curl -s http://127.0.0.1:8080/api/v0/outlet/metrics | grep 'core_received'
akvorado_outlet_core_received_flows_total{exporter="x.x.x.x"} 64403
akvorado_outlet_core_received_raw_flows_total 40528
```

```
# curl -s http://127.0.0.1:8080/api/v0/outlet/metrics | grep 'core_forwarded'
empty
```

**Reply by vincentbernat** [reply]
In `docker/versions.yml`, can you replace `:2.0.4` with `:main`? Then, you should get a better hint in the logs about the problem. Note that conntrack-fixer has been removed. You can remove it from `docker/docker-compose.yml` as well. Alternatively, a look at what you get in tcpdump for SNMP would help.

**Reply by stereu** [reply]
Done, but no more hints in the logs.
I let the tcpdump run for at least 15min and currently no recorded SNMP traffic even after restarting the whole stack.

**Reply by vincentbernat** [reply]
Because of the cache, you need a bit more time. By default, the refresh should happen every 30 minutes.

**Reply by stereu** [reply]
nvm, here the first dumps
```
# tcpdump -i any port 161 -n
15:16:08.084008 veth2ba0ac6 P   IP 247.16.14.11.50881 > x.x.x.x.161:  C="community" GetRequest(99)  .1.3.6.1.2.1.1.5.0 .1.3.6.1.2.1.2.2.1.2.597 .1.3.6.1.2.1.31.1.1.1.1.597 .1.3.6.1.2.1.31.1.1.1.18.597 .1.3.6.1.2.1.31.1.1.1.15.597
15:16:08.084008 br-akvorado In  IP 247.16.14.11.50881 > x.x.x.x.161:  C="community" GetRequest(99)  .1.3.6.1.2.1.1.5.0 .1.3.6.1.2.1.2.2.1.2.597 .1.3.6.1.2.1.31.1.1.1.1.597 .1.3.6.1.2.1.31.1.1.1.18.597 .1.3.6.1.2.1.31.1.1.1.15.597
15:16:08.084045 enp1s0 Out IP x.x.x.x.50881 > x.x.x.x.161:  C="community" GetRequest(99)  .1.3.6.1.2.1.1.5.0 .1.3.6.1.2.1.2.2.1.2.597 .1.3.6.1.2.1.31.1.1.1.1.597 .1.3.6.1.2.1.31.1.1.1.18.597 .1.3.6.1.2.1.31.1.1.1.15.597
15:16:08.085785 enp1s0 In  IP x.x.x.x.161 > x.x.x.x.50881:  C="community" GetResponse(116)  .1.3.6.1.2.1.1.5.0="" .1.3.6.1.2.1.2.2.1.2.597="ae0.108" .1.3.6.1.2.1.31.1.1.1.1.597="ae0.108" .1.3.6.1.2.1.31.1.1.1.18.597="" .1.3.6.1.2.1.31.1.1.1.15.597=200000
15:16:08.085795 br-akvorado Out IP x.x.x.x.161 > 247.16.14.11.50881:  C="community" GetResponse(116)  .1.3.6.1.2.1.1.5.0="" .1.3.6.1.2.1.2.2.1.2.597="ae0.108" .1.3.6.1.2.1.31.1.1.1.1.597="ae0.108" .1.3.6.1.2.1.31.1.1.1.18.597="" .1.3.6.1.2.1.31.1.1.1.15.597=200000
15:16:08.085798 veth2ba0ac6 Out IP x.x.x.x.161 > 247.16.14.11.50881:  C="community" GetResponse(116)  .1.3.6.1.2.1.1.5.0="" .1.3.6.1.2.1.2.2.1.2.597="ae0.108" .1.3.6.1.2.1.31.1.1.1.1.597="ae0.108" .1.3.6.1.2.1.31.1.1.1.18.597="" .1.3.6.1.2.1.31.1.1.1.15.597=200000
```

**Reply by vincentbernat** [reply, marked as answer]
OK, the problem is that sysName is empty. This was not tested previously. Has your exporter a hostname?

**Reply by stereu** [reply]
Added a hostname and its working now. Thanks Vincent!
