### DISCUSSION TITLE
sflow input and output interfaces missing

### DISCUSSION THREAD

**Discussion by dietybright** [akvorado/akvorado#1463] [Q&A]
Netflow is working fine on our router, we are trying with another device support sflow.

The graph when filtering sflow exporter only show same src/dst as 132602.

Grap flow on <ip>:8081/api/v0/inlet/flows showing Inif and Outif value normaly but no SrcAddr and DstAddr
{"TimeReceived":1730278879,"SamplingRate":4096,"ExporterAddress":"::ffff:172.16.x.117","InIf":369098852,"OutIf":436215808,"SrcVlan":0,"DstVlan":0,"SrcAddr":"","DstAddr":"","NextHop":"","SrcAS":132602,"DstAS":132602,"GotASPath":false,"SrcNetMask":118,"DstNetMask":118}

curl -s http://127.0.0.1:8080/api/v0/inlet/metrics | grep 'input and output interfaces missing' increasing
akvorado_inlet_core_flows_errors_total{error="input and output interfaces missing",exporter="172.16.10.117"} 225
akvorado_inlet_core_flows_errors_total{error="input and output interfaces missing",exporter="172.17.128.58"} 228

Any idea?

**Comment by vincentbernat** [comment]
Capture the flow with tcpdump and check with Wireshark if you have the missing information.

**Reply by dietybright** [reply]
Here is wireshark capture, input/output interface stil visible

```
Frame 1: 1190 bytes on wire (9520 bits), 1190 bytes captured (9520 bits)
Ethernet II, Src: VMware_89:7e:2c (00:50:56:89:7e:2c), Dst: aa:d1:32:22:14:81 (aa:d1:32:22:14:81)
Internet Protocol Version 4, Src: 172.16.10.117, Dst: 172.16.26.51
User Datagram Protocol, Src Port: 59716, Dst Port: 6343
    Source Port: 59716
    Destination Port: 6343
    Length: 1156
    Checksum: 0xab0c [unverified]
    [Checksum Status: Unverified]
    [Stream index: 0]
    [Timestamps]
    UDP payload (1148 bytes)
InMon sFlow
    Datagram version: 5
    Agent address type: IPv4 (1)
    Agent address: 172.16.10.117
    Sub-agent ID: 100
    Sequence number: 2299165
    SysUptime: 34 days, 3 hours, 45 minutes, 48 seconds (2951148040ms)
    NumSamples: 6
    Expanded flow sample, seq 6719
        0000 0000 0000 0000 0000 .... .... .... = Enterprise: standard sFlow (0)
        .... .... .... .... .... 0000 0000 0011 = sFlow sample type: Expanded flow sample (3)
        Sample length (byte): 144
        Sequence number: 6719
        Source ID type: 0
        Source ID index: 369098852
        Sampling rate: 1 out of 4096 packets
        Sample pool: 112030288 total packets
        Dropped packets: 32
        Input interface format: 0
        Input interface value: 436215808
        .000 0000 0000 0000 0000 0000 0000 0000 = Output interface format: 0
        Output interface value: 369098852
        Flow record: 1
        Raw packet header
    Expanded flow sample, seq 3871
    Expanded flow sample, seq 6720
    Expanded flow sample, seq 3872
    Expanded flow sample, seq 6721
    Expanded flow sample, seq 3873
```

**Reply by vincentbernat** [reply]
Can you expand the "Raw packet header"?

**Reply by dietybright** [reply]
```
Frame 1: 1190 bytes on wire (9520 bits), 1190 bytes captured (9520 bits)
Ethernet II, Src: VMware_89:7e:2c (00:50:56:89:7e:2c), Dst: aa:d1:32:22:14:81 (aa:d1:32:22:14:81)
Internet Protocol Version 4, Src: 172.16.10.117, Dst: 172.16.26.51
User Datagram Protocol, Src Port: 59716, Dst Port: 6343
    Source Port: 59716
    Destination Port: 6343
    Length: 1156
    Checksum: 0xab0c [unverified]
    [Checksum Status: Unverified]
    [Stream index: 0]
    [Timestamps]
    UDP payload (1148 bytes)
InMon sFlow
    Datagram version: 5
    Agent address type: IPv4 (1)
    Agent address: 172.16.10.117
    Sub-agent ID: 100
    Sequence number: 2299165
    SysUptime: 34 days, 3 hours, 45 minutes, 48 seconds (2951148040ms)
    NumSamples: 6
    Expanded flow sample, seq 6719
        0000 0000 0000 0000 0000 .... .... .... = Enterprise: standard sFlow (0)
        .... .... .... .... .... 0000 0000 0011 = sFlow sample type: Expanded flow sample (3)
        Sample length (byte): 144
        Sequence number: 6719
        Source ID type: 0
        Source ID index: 369098852
        Sampling rate: 1 out of 4096 packets
        Sample pool: 112030288 total packets
        Dropped packets: 32
        Input interface format: 0
        Input interface value: 436215808
        .000 0000 0000 0000 0000 0000 0000 0000 = Output interface format: 0
        Output interface value: 369098852
        Flow record: 1
        Raw packet header
            0000 0000 0000 0000 0000 .... .... .... = Enterprise: standard sFlow (0)
            Format: Raw packet header (1)
            Flow data length (byte): 92
            Header protocol: Ethernet (1)
            Frame Length: 78
            Payload stripped: 4
            Sampled header length: 74
            Header of sampled packet: 4caea3520ff6a0369f3ca85481000426810005d508004500003428ba40003906d2db11f8…
                Ethernet II, Src: IntelCor_3c:a8:54 (a0:36:9f:3c:a8:54), Dst: HewlettP_52:0f:f6 (4c:ae:a3:52:0f:f6)
                802.1Q Virtual LAN, PRI: 0, DEI: 0, ID: 1062
                802.1Q Virtual LAN, PRI: 0, DEI: 0, ID: 1493
                Internet Protocol Version 4, Src: 17.248.<ommited>.1, Dst: 121.50.<ommited>.2
                Transmission Control Protocol, Src Port: 443, Dst Port: 61297, Seq: 304936883, Ack: 2938370499
                    Source Port: 443
                    Destination Port: 61297
                    [Stream index: 0]
                    [Conversation completeness: Incomplete (4)]
                    Sequence Number: 304936883    (relative sequence number)
                    Sequence Number (raw): 304936883
                    Acknowledgment Number: 2938370499    (relative ack number)
                    Acknowledgment number (raw): 2938370499
                    1000 .... = Header Length: 32 bytes (8)
                    Flags: 0x010 (ACK)
                        000. .... .... = Reserved: Not set
                        ...0 .... .... = Accurate ECN: Not set
                        .... 0... .... = Congestion Window Reduced: Not set
                        .... .0.. .... = ECN-Echo: Not set
                        .... ..0. .... = Urgent: Not set
                        .... ...1 .... = Acknowledgment: Set
                        .... .... 0... = Push: Not set
                        .... .... .0.. = Reset: Not set
                        .... .... ..0. = Syn: Not set
                        .... .... ...0 = Fin: Not set
                        [TCP Flags: ·······A····]
                    Window: 126
                    [Calculated window size: 126]
                    [Window size scaling factor: -1 (unknown)]
                    Checksum: 0xa104 [unverified]
                    [Checksum Status: Unverified]
                    Urgent Pointer: 0
                    Options: (12 bytes), No-Operation (NOP), No-Operation (NOP), Timestamps
                        TCP Option - No-Operation (NOP)
                        TCP Option - No-Operation (NOP)
                        TCP Option - Timestamps
                    [Timestamps]
    Expanded flow sample, seq 3871
    Expanded flow sample, seq 6720
    Expanded flow sample, seq 3872
    Expanded flow sample, seq 6721
    Expanded flow sample, seq 3873
```

**Reply by vincentbernat** [reply]
Can you send me the packet by email?

**Reply by dietybright** [reply]
Hi Vincent, kindly check your email

**Reply by vincentbernat** [reply]
For IP information, I have fixed that (QinQ packets were not decoded correctly). Again, use `akvorado:main` to test once the build is complete: https://github.com/akvorado/akvorado/actions/runs/11607719588

For input/output interface missing, are the counters increasing? They seem low.

**Reply by dietybright** [reply]
Hi Vincent,

Graph seem good now,

input and output interfaces missing still increasing

```
# curl -s http://127.0.0.1:8080/api/v0/inlet/metrics | grep 'interfaces missing'
akvorado_inlet_core_flows_errors_total{error="input and output interfaces missing",exporter="172.16.10.117"} 48
akvorado_inlet_core_flows_errors_total{error="input and output interfaces missing",exporter="172.17.128.58"} 48

[2024-10-31 17:16:23] /opt/akvorado
# curl -s http://127.0.0.1:8080/api/v0/inlet/metrics | grep 'interfaces missing'
akvorado_inlet_core_flows_errors_total{error="input and output interfaces missing",exporter="172.16.10.117"} 52
akvorado_inlet_core_flows_errors_total{error="input and output interfaces missing",exporter="172.17.128.58"} 52
```
