### DISCUSSION TITLE
metadata missing

### DISCUSSION THREAD

**Discussion by matou801-ctrl** [akvorado/akvorado#2212] [Q&A] [answered]
Hello,

I'm having a problem on the interface with Akvorado 2.1.0 (docker-composer). 
0 exporters are displayed on the interface and therefore no flows. Having followed the troubleshooting steps in the documentation, but without success. I think the problem lies there."metadata missing". I configured netflow+snmp on Cisco IOS-XE  

 curl -s http://127.0.0.1:8080/api/v0/outlet/metrics | grep 'akvorado_outlet_core.*errors'
**akvorado_outlet_core_flows_errors_total{error="metadata missing",exporter="247.16.0.1"} 12495**

 curl -s http://127.0.0.1:8081/api/v0/inlet/metrics | grep '^akvorado_inlet'
akvorado_inlet_flow_input_udp_buffer_size_bytes{listener=":2055",worker="0"} 425984
akvorado_inlet_flow_input_udp_buffer_size_bytes{listener=":2055",worker="1"} 425984
akvorado_inlet_flow_input_udp_buffer_size_bytes{listener=":2055",worker="2"} 425984
akvorado_inlet_flow_input_udp_buffer_size_bytes{listener=":2055",worker="3"} 425984

snmpwalk -Cc -c helloworld -v2c -On  X.X.X.X  --> It works and SNMP returns values.

inlet.yaml
---
flow:
  inputs:
    # NetFlow port
    - type: udp
      decoder: netflow
      listen: :2055
      workers: 4

outlet.yaml
---
metadata:
  providers:
    - type: snmp
      credentials:
        ::/0:
          communities:
             - helloworld
 default-sampling-rate: 100
 etc.....

CISCO IOS-XE : 
snmp-server community helloworld RO 10

Thank you for help

Matthieu

**Comment by vincentbernat** [comment]
Use the tcpdump command included in the troubleshooting documentation to check for SNMP requests done by Akvorado.

**Comment by matou801-ctrl** [comment]
tcpdump -c3 -pni any host X.X.X.X and port 2055
tcpdump: data link type LINUX_SLL2
tcpdump: verbose output suppressed, use -v[v]... for full protocol decode
listening on any, link-type LINUX_SLL2 (Linux cooked v2), snapshot length 262144 bytes
16:01:41.334971 eth0  In  IP X.X.X.X.53824 > X.X.X.X.2055: UDP, length 1352
16:01:41.334971 eth0  In  IP X.X.X.X.53824 > X.X.X.X.2055: UDP, length 1352
16:01:41.334971 eth0  In  IP X.X.X.X.53824 > X.X.X.X.2055: UDP, length 1352
3 packets captured
7 packets received by filter
0 packets dropped by kernel

**Reply by vincentbernat** [reply]
<img width="1389" height="704" alt="image" src="https://github.com/user-attachments/assets/78445b10-1e80-4868-9d5f-13c7520da9cb" />

**Comment by matou801-ctrl** [comment]
nsenter -t $(pgrep -fo "akvorado outlet") -n tcpdump -c3 -pni eth0 port 161
tcpdump: verbose output suppressed, use -v[v]... for full protocol decode
listening on eth0, link-type EN10MB (Ethernet), snapshot length 262144 bytes
21:20:45.481939 IP 247.16.0.9.45403 > 247.16.0.1.161:  C="helloworld" GetRequest(95)  .1.3.6.1.2.1.1.5.0 .1.3.6.1.2.1.2.2.1.2.70 .1.3.6.1.2.1.31.1.1.1.1.70 .1.3.6.1.2.1.31.1.1.1.18.70 .1.3.6.1.2.1.31.1.1.1.15.70
21:20:46.482026 IP 247.16.0.9.45403 > 247.16.0.1.161:  C="helloworld" GetRequest(95)  .1.3.6.1.2.1.1.5.0 .1.3.6.1.2.1.2.2.1.2.70 .1.3.6.1.2.1.31.1.1.1.1.70 .1.3.6.1.2.1.31.1.1.1.18.70 .1.3.6.1.2.1.31.1.1.1.15.70
21:20:47.482517 IP 247.16.0.9.45403 > 247.16.0.1.161:  C="@helloworld" GetRequest(95)  .1.3.6.1.2.1.1.5.0 .1.3.6.1.2.1.2.2.1.2.70 .1.3.6.1.2.1.31.1.1.1.1.70 .1.3.6.1.2.1.31.1.1.1.18.70 .1.3.6.1.2.1.31.1.1.1.15.70
3 packets captured
3 packets received by filter
0 packets dropped by kernel

**Reply by vincentbernat** [reply]
Which version of Docker are you using? `docker version`

**Reply by matou801-ctrl** [reply]
docker version
Client:
 Version:           20.10.24+dfsg1
 API version:       1.41
 Go version:        go1.19.8
 Git commit:        297e128
 Built:             Sat Jan  3 00:46:39 2026
 OS/Arch:           linux/amd64
 Context:           default
 Experimental:      true

Server:
 Engine:
  Version:          20.10.24+dfsg1
  API version:      1.41 (minimum version 1.12)
  Go version:       go1.19.8
  Git commit:       5d6db84
  Built:            Sat Jan  3 00:46:39 2026
  OS/Arch:          linux/amd64
  Experimental:     false
 containerd:
  Version:          1.6.20~ds1
  GitCommit:        1.6.20~ds1-1+deb12u2
 runc:
  Version:          1.1.5+ds1
  GitCommit:        1.1.5+ds1-1+deb12u1
 docker-init:
  Version:          0.19.0
  GitCommit:

**Reply by vincentbernat** [reply, marked as answer]
It's too old. The minimum supported version of Docker is 23. You could upgrade to Debian 13 or install [Docker from Docker](https://docs.docker.com/engine/install/).

**Reply by matou801-ctrl** [reply]
It's ok. Upgrade to Debian 13 + Docker.!! 

Thank you for the quality of support.
