### DISCUSSION TITLE
How to add snmpv3 correct syntax? Im getting this error , and graph not showing

### DISCUSSION THREAD

**Discussion by chupztugz000000000** [akvorado/akvorado#1854] [Q&A]
im getting this error 
"unable to GET (9 OIDs)"}
{"level":"error","error":"request timeout (after 2 retries)","exporter":"10.21.56.1","time":"2025-07-21T19:38:00Z","caller":"akvorado/inlet/metadata/provider/snmp/poller.go:119","module":"akvorado/inlet/metadata/provider/snmp","message":"unable to GET (5 OIDs)"}
{"level":"info","handler":"/api/","method":"GET","url":"/api/v0/healthcheck","ip":"[::1]:33054","user-agent":"Go-http-client/1.1","status":200,"size":230,"duration":0.14711,"time":"2025-07-21T19:38:07Z","caller":"akvorado/common/httpserver/root.go:88","module":"akvorado/common/httpserver","message":"HTTP request"}
{"level":"error","error":"request timeout (after 2 retries)","exporter":"10.21.56.1","time":"2025-07-21T19:38:15Z","caller":"akvorado/inlet/metadata/provider/snmp/poller.go:119","module":"akvorado/inlet/metadata/provider/snmp","message":"unable to GET (9 OIDs)"}
{"level":"error","error":"request timeout (after 2 retries)","exporter":"10.21.56.1","time":"2025-07-21T19:38:16Z","caller":"akvorado/inlet/metadata/provider/snmp/poller.go:119","module":"akvorado/inlet/metadata/provider/snmp","message":"unable to GET (5 OIDs)"}
{"level":"error","error":"request timeout (after 2 retries)","exporter":"10.21.56.1","time":"2025-07-21T19:38:17Z","caller":"akvorado/inlet/metadata/provider/snmp/poller.go:119","module":"akvorado/inlet/metadata/provider/snmp","message":"unable to GET (5 OIDs)"}
{"level":"info","handler":"/api/","method":"GET","url":"/api/v0/healthcheck","ip":"[::1]:52672","user-agent":"Go-http-client/1.1","status":200,"size":230,"duration":1.377948,"time":"2025-07-21T19:38:27Z","caller":"akvorado/common/httpserver/root.go:88","module":"akvorado/common/httpserver","message":"HTTP request"}
{"level":"error","error":"request timeout (after 2 retries)","exporter":"10.21.56.1","time":"2025-07-21T19:38:31Z","caller":"akvorado/inlet/metadata/provider/snmp/poller.go:119","module":"akvorado/inlet/metadata/provider/snmp","message":"unable to GET (9 OIDs)"}
{"level":"error","error":"request timeout (after 2 retries)","exporter":"10.21.56.1","time":"2025-07-21T19:38:33Z","caller":"akvorado/inlet/metadata/provider/snmp/poller.go:119","module":"akvorado/inlet/metadata/provider/snmp","message":"unable to GET (5 OIDs)"}

this is my inlet yaml looks

metadata:
  workers: 10
  providers:
    - type: snmp
      credentials:
        "0.0.0.0/0":
          user-name: xxxxx
          authentication-protocol: SHA
          authentication-passphrase:xxxxxx
          privacy-protocol: DES
          privacy-passphrase: xxxxxxx
      poller-retries: 2
      poller-timeout: 5s
<img width="1039" height="810" alt="image" src="https://github.com/user-attachments/assets/ac3d1966-120a-4956-b0c2-e9ab4c8f25e0" />

**Comment by Wilda-LK** [comment]
here's an example of what your inlet.yaml should look like


kafka:
  compression-codec: zstd

metadata:
  workers: 10
  provider:
    type: snmp
    credentials:
      "ip.address.of.router":
        username: mysnmp
        authentication-protocol: md5
        privacy-protocol: aes
        authentication-passphrase: hello123
        privacy-passphrase: G00dby34567

flow:
  inputs:
    - type: udp
      decoder: netflow
      listen: ":2055"
      workers: 6
      receive-buffer: 10485760
    - type: udp
      decoder: sflow
      listen: ":6343"
      workers: 6
      receive-buffer: 10485760

core:
  default-sampling-rate:
    "ip.address.of.router": 20
  workers: 6
  exporter-classifiers:
    # This is an example. This must be customized depending on the
    # descriptions of your interfaces. In the following, we assume
    # external interfaces are named "Transit: Cogent" Or "IX:
    # FranceIX".
    #- |
    #  ClassifyConnectivityRegex(Interface.Description, "^(?i)(transit|pni|ppni|ix):? ", "$1") &&
    #  ClassifyProviderRegex(Interface.Description, "^\\S+?\\s(\\S+)", "$1") &&
    #  ClassifyExternal()
    #- ClassifyInternal()

**Reply by roopeshsn** [reply]
But this documentation tells to put the metadata of type snmp to outlet.

outlet → metadata → provider → communities

https://demo.akvorado.net/docs/intro#quick-start

**Reply by chupztugz000000000** [reply]
i followed your step and got the error for this when i run 

 curl -s http://127.0.0.1:8080/api/v0/inlet/metrics | grep 'akvorado_.*_error'

<img width="1025" height="196" alt="image" src="https://github.com/user-attachments/assets/9ba3ecb5-4a99-46f1-983a-673704123746" />

**Reply by chupztugz000000000** [reply]
sharing my inlet. yaml 

---
kafka:
  compression-codec: zstd

metadata:
  workers: 10
  providers:
    - type: snmp
      credentials:
        "10.21.56.1":
          user-name: Usymv3
          authentication-protocol: SHA
          authentication-passphrase: M0n1t0r1ng
          privacy-protocol: DES
          privacy-passphrase: M0n1t0r1ng

flow:
  inputs:
    - type: udp
      decoder: netflow
      listen: :2055
      workers: 6
      receive-buffer: 10485760
    - type: udp
      decoder: sflow
      listen: :6343
      workers: 6
      receive-buffer: 10485760

core:
  # Number of worker threads for processing flows.
  # Adjust based on the number of CPU cores available.
  default-sampling-rate: 20
  workers: 6

  # Classifiers for exporters (devices sending flows).
  exporter-classifiers:
    # Extract site from exporter name before the first '-'.
    # Example: "NYC-FW1" -> Site: "NYC".
    - ClassifySiteRegex(Exporter.Name, '^([^-]+)-', '$1')

    # Hardcode region, tenant, and role.
    - ClassifyRegion('Asia')
    - ClassifyTenant('Ubiquity')
    - ClassifyRole('Firewall')

  # Classifiers for interfaces based on name and description.
  interface-classifiers:
    # Match external interfaces such as Transit, PNI, PPNI, or IX.
    # Example: "Transit: Cogent" -> Connectivity: Transit, Provider: Cogent.
    - |
      ClassifyConnectivityRegex(Interface.Description, '^(?i)(transit|pni|ppni|ix):? ', '$1') &&
      ClassifyProviderRegex(Interface.Description, '^\\S+?\\s(\\S+)', '$1') &&
      ClassifyExternal()

    # Match point-to-point (P2P) links.
    # Example: "p2p link to 10.9" -> Connectivity: p2p, External.
    - |
      ClassifyConnectivityRegex(Interface.Description, '(?i)p2p', 'p2p') &&
      ClassifyExternal()

    # Match GRE interfaces by interface name (e.g., "gr-0/0/0.40").
    # Mark them as GRE connectivity and Internal.
    - |
      ClassifyConnectivityRegex(Interface.Name, '^(?i)gr-', 'GRE') &&
      ClassifyInternal()

    # Default classification for other internal interfaces.
    - ClassifyInternal()
@vincentbernat   @roopeshsn  @Wilda-LK  please help me guys the only error i getting now is the snmp

**Reply by chupztugz000000000** [reply]
when i do tcp dump this is the error please guide me guys 
S:snmpUsmMIB.usmMIBObjects.usmStats.usmStatsWrongDigests.0=13863
13:46:36.792736 veth96d3efe P   IP 172.18.0.9.33829 > 10.21.56.1.snmp:  F=r U="" E= C="" GetRequest(14)
13:46:36.792736 br-8d71e7e6f26d In  IP 172.18.0.9.33829 > 10.21.56.1.snmp:  F=r U="" E= C="" GetRequest(14)
13:46:36.792824 enp3s0 Out IP 10.8.254.25.33829 > 10.21.56.1.snmp:  F=r U="" E= C="" GetRequest(14)
13:46:37.792906 veth96d3efe P   IP 172.18.0.9.33829 > 10.21.56.1.snmp:  F=r U="" E= C="" GetRequest(14)
13:46:37.792906 br-8d71e7e6f26d In  IP 172.18.0.9.33829 > 10.21.56.1.snmp:  F=r U="" E= C="" GetRequest(14)
13:46:37.792960 enp3s0 Out IP 10.8.254.25.33829 > 10.21.56.1.snmp:  F=r U="" E= C="" GetRequest(14)
13:46:39.916342 veth96d3efe P   IP 172.18.0.9.46877 > 10.21.56.1.snmp:  F=r U="" E= C="" GetRequest(14)
13:46:39.916342 br-8d71e7e6f26d In  IP 172.18.0.9.46877 > 10.21.56.1.snmp:  F=r U="" E= C="" GetRequest(14)
13:46:39.916429 enp3s0 Out IP 10.8.254.25.46877 > 10.21.56.1.snmp:  F=r U="" E= C="" GetRequest(14)
13:46:40.916937 veth96d3efe P   IP 172.18.0.9.46877 > 10.21.56.1.snmp:  F=r U="" E= C="" GetRequest(14)
13:46:40.916937 br-8d71e7e6f26d In  IP 172.18.0.9.46877 > 10.21.56.1.snmp:  F=r U="" E= C="" GetRequest(14)
13:46:40.917072 enp3s0 Out IP 10.8.254.25.46877 > 10.21.56.1.snmp:  F=r U="" E= C="" GetRequest(14)
13:46:42.086209 veth96d3efe P   IP 172.18.0.9.39108 > 10.21.56.1.snmp:  F=r U="" E= C="" GetRequest(14)
13:46:42.086209 br-8d71e7e6f26d In  IP 172.18.0.9.39108 > 10.21.56.1.snmp:  F=r U="" E= C="" GetRequest(14)
13:46:42.086298 enp3s0 Out IP 10.8.254.25.39108 > 10.21.56.1.snmp:  F=r U="" E= C="" GetRequest(14)
13:46:43.086843 veth96d3efe P   IP 172.18.0.9.39108 > 10.21.56.1.snmp:  F=r U="" E= C="" GetRequest(14)
13:46:43.086843 br-8d71e7e6f26d In  IP 172.18.0.9.39108 > 10.21.56.1.snmp:  F=r U="" E= C="" GetRequest(14)
13:46:43.086944 enp3s0 Out IP 10.8.254.25.39108 > 10.21.56.1.snmp:  F=r U="" E= C="" GetRequest(14)
13:46:44.171106 veth96d3efe P   IP 172.18.0.9.39198 > 10.21.56.1.snmp:  F=r U="" E= C="" GetRequest(14)
13:46:44.171106 br-8d71e7e6f26d In  IP 172.18.0.9.39198 > 10.21.56.1.snmp:  F=r U="" E= C="" GetRequest(14)
13:46:44.171146 enp3s0 Out IP 10.8.254.25.39198 > 10.21.56.1.snmp:  F=r U="" E= C="" GetRequest(14)
13:46:45.171667 veth96d3efe P   IP 172.18.0.9.39198 > 10.21.56.1.snmp:  F=r U="" E= C="" GetRequest(14)
13:46:45.171667 br-8d71e7e6f26d In  IP 172.18.0.9.39198 > 10.21.56.1.snmp:  F=r U="" E= C="" GetRequest(14)
13:46:45.171736 enp3s0 Out IP 10.8.254.25.39198 > 10.21.56.1.snmp:  F=r U="" E= C="" GetRequest(14)
13:46:46.174076 veth96d3efe P   IP 172.18.0.9.39130 > 10.21.56.1.snmp:  F=r U="" E= C="" GetRequest(14)
13:46:46.174076 br-8d71e7e6f26d In  IP 172.18.0.9.39130 > 10.21.56.1.snmp:  F=r U="" E= C="" GetRequest(14)
13:46:46.174161 enp3s0 Out IP 10.8.254.25.39130 > 10.21.56.1.snmp:  F=r U="" E= C="" GetRequest(14)
13:46:47.174617 veth96d3efe P   IP 172.18.0.9.39130 > 10.21.56.1.snmp:  F=r U="" E= C="" GetRequest(14)
13:46:47.174617 br-8d71e7e6f26d In  IP 172.18.0.9.39130 > 10.21.56.1.snmp:  F=r U="" E= C="" GetRequest(14)
13:46:47.174899 enp3s0 Out IP 10.8.254.25.39130 > 10.21.56.1.snmp:  F=r U="" E= C="" GetRequest(14)
13:46:47.299035 veth96d3efe P   IP 172.18.0.9.60478 > 10.21.56.1.snmp:  F=r U="" E= C="" GetRequest(14)
13:46:47.299035 br-8d71e7e6f26d In  IP 172.18.0.9.60478 > 10.21.56.1.snmp:  F=r U="" E= C="" GetRequest(14)
13:46:47.299117 enp3s0 Out IP 10.8.254.25.60478 > 10.21.56.1.snmp:  F=r U="" E= C="" GetRequest(14)
13:46:47.334558 enp3s0 In  IP 10.21.56.1.snmp > 10.8.254.25.60478:  F= U="" E=_80_00_0a_4c_01_0a_15_00_01 C="" Report(33)  S:snmpUsmMIB.usmMIBObjects.usmStats.usmStatsUnknownEngineIDs.0=1841293
13:46:47.334647 br-8d71e7e6f26d Out IP 10.21.56.1.snmp > 172.18.0.9.60478:  F= U="" E=_80_00_0a_4c_01_0a_15_00_01 C="" Report(33)  S:snmpUsmMIB.usmMIBObjects.usmStats.usmStatsUnknownEngineIDs.0=1841293
13:46:47.334664 veth96d3efe Out IP 10.21.56.1.snmp > 172.18.0.9.60478:  F= U="" E=_80_00_0a_4c_01_0a_15_00_01 C="" Report(33)  S:snmpUsmMIB.usmMIBObjects.usmStats.usmStatsUnknownEngineIDs.0=1841293
13:46:47.335469 veth96d3efe P   IP 172.18.0.9.60478 > 10.21.56.1.snmp:  F=apr U="Usymv3" [!scoped PDU]57_84_e6_9c_84_3f_31_fe_29_c6_9c_3c_57_3d_7f_18_b2_96_98_73_4a_49_24_74_73_c4_b0_d5_7e_a4_0f_c5_55_15_67_b2_89_b3_6a_4f_57_a5_6f_83_01_80_31_72_14_3e_82_eb_29_da_e2_3c_55_87_73_63_66_8a_52_6b_bb_de_38_30_4c_7d_8c_30_44_f1_99_40_4b_ce_56_98_a6_bb_cf_c6_c5_67_12_2d_9b_d5_d3_5e_0c_82_77_c0_f2_35_7e_b7_42_03_88_1e_9c_bf_78_9b_43_a7_b5_c0_73_c8_c9_29_7c_f1_fa_95_e5_c6_f3_f9_d8_c9_9b_11_7c_ea_64_c1_b6_8b_99_b8_00_ce_ad_5c_b3_fb_a9_19_62_fd_ef_e1_42_a8_a9_de_ba_7a_f1_eb_3b_9d_ea_03_67_2b_6e_29_82_ee_2e_61_c7_c0_89_f0_ac_1e_06_41_5d_75_e7_99_a7_54_8d_e5_1e_27_72_0c_04_be_09_0d
13:46:47.335469 br-8d71e7e6f26d In  IP 172.18.0.9.60478 > 10.21.56.1.snmp:  F=apr U="Usymv3" [!scoped PDU]57_84_e6_9c_84_3f_31_fe_29_c6_9c_3c_57_3d_7f_18_b2_96_98_73_4a_49_24_74_73_c4_b0_d5_7e_a4_0f_c5_55_15_67_b2_89_b3_6a_4f_57_a5_6f_83_01_80_31_72_14_3e_82_eb_29_da_e2_3c_55_87_73_63_66_8a_52_6b_bb_de_38_30_4c_7d_8c_30_44_f1_99_40_4b_ce_56_98_a6_bb_cf_c6_c5_67_12_2d_9b_d5_d3_5e_0c_82_77_c0_f2_35_7e_b7_42_03_88_1e_9c_bf_78_9b_43_a7_b5_c0_73_c8_c9_29_7c_f1_fa_95_e5_c6_f3_f9_d8_c9_9b_11_7c_ea_64_c1_b6_8b_99_b8_00_ce_ad_5c_b3_fb_a9_19_62_fd_ef_e1_42_a8_a9_de_ba_7a_f1_eb_3b_9d_ea_03_67_2b_6e_29_82_ee_2e_61_c7_c0_89_f0_ac_1e_06_41_5d_75_e7_99_a7_54_8d_e5_1e_27_72_0c_04_be_09_0d
13:46:47.335537 enp3s0 Out IP 10.8.254.25.60478 > 10.21.56.1.snmp:  F=apr U="Usymv3" [!scoped PDU]57_84_e6_9c_84_3f_31_fe_29_c6_9c_3c_57_3d_7f_18_b2_96_98_73_4a_49_24_74_73_c4_b0_d5_7e_a4_0f_c5_55_15_67_b2_89_b3_6a_4f_57_a5_6f_83_01_80_31_72_14_3e_82_eb_29_da_e2_3c_55_87_73_63_66_8a_52_6b_bb_de_38_30_4c_7d_8c_30_44_f1_99_40_4b_ce_56_98_a6_bb_cf_c6_c5_67_12_2d_9b_d5_d3_5e_0c_82_77_c0_f2_35_7e_b7_42_03_88_1e_9c_bf_78_9b_43_a7_b5_c0_73_c8_c9_29_7c_f1_fa_95_e5_c6_f3_f9_d8_c9_9b_11_7c_ea_64_c1_b6_8b_99_b8_00_ce_ad_5c_b3_fb_a9_19_62_fd_ef_e1_42_a8_a9_de_ba_7a_f1_eb_3b_9d_ea_03_67_2b_6e_29_82_ee_2e_61_c7_c0_89_f0_ac_1e_06_41_5d_75_e7_99_a7_54_8d_e5_1e_27_72_0c_04_be_09_0d
13:46:47.372280 enp3s0 In  IP 10.21.56.1.snmp > 10.8.254.25.60478:  F= U="Usymv3" E=_80_00_0a_4c_01_0a_15_00_01 C="" Report(29)  S:snmpUsmMIB.usmMIBObjects.usmStats.usmStatsWrongDigests.0=13864
13:46:47.372369 br-8d71e7e6f26d Out IP 10.21.56.1.snmp > 172.18.0.9.60478:  F= U="Usymv3" E=_80_00_0a_4c_01_0a_15_00_01 C="" Report(29)  S:snmpUsmMIB.usmMIBObjects.usmStats.usmStatsWrongDigests.0=13864
13:46:47.372385 veth96d3efe Out IP 10.21.56.1.snmp > 172.18.0.9.60478:  F= U="Usymv3" E=_80_00_0a_4c_01_0a_15_00_01 C="" Report(29)  S:snmpUsmMIB.usmMIBObjects.usmStats.usmStatsWrongDigests.0=13864
13:46:50.427918 veth96d3efe P   IP 172.18.0.9.38610 > 10.21.56.1.snmp:  F=r U="" E= C="" GetRequest(14)
13:46:50.427918 veth96d3efe P   IP 172.18.0.9.42257 > 10.21.56.1.snmp:  F=r U="" E= C="" GetRequest(14)
13:46:50.427918 br-8d71e7e6f26d In  IP 172.18.0.9.42257 > 10.21.56.1.snmp:  F=r U="" E= C="" GetRequest(14)
13:46:50.427918 br-8d71e7e6f26d In  IP 172.18.0.9.38610 > 10.21.56.1.snmp:  F=r U="" E= C="" GetRequest(14)
13:46:50.428001 enp3s0 Out IP 10.8.254.25.42257 > 10.21.56.1.snmp:  F=r U="" E= C="" GetRequest(14)
13:46:50.428028 enp3s0 Out IP 10.8.254.25.38610 > 10.21.56.1.snmp:  F=r U="" E= C="" GetRequest(14)
13:46:51.428936 veth96d3efe P   IP 172.18.0.9.38610 > 10.21.56.1.snmp:  F=r U="" E= C="" GetRequest(14)
13:46:51.428956 veth96d3efe P   IP 172.18.0.9.42257 > 10.21.56.1.snmp:  F=r U="" E= C="" GetRequest(14)
13:46:51.428936 br-8d71e7e6f26d In  IP 172.18.0.9.38610 > 10.21.56.1.snmp:  F=r U="" E= C="" GetRequest(14)
13:46:51.428956 br-8d71e7e6f26d In  IP 172.18.0.9.42257 > 10.21.56.1.snmp:  F=r U="" E= C="" GetRequest(14)
13:46:51.429001 enp3s0 Out IP 10.8.254.25.38610 > 10.21.56.1.snmp:  F=r U="" E= C="" GetRequest(14)
13:46:51.429027 enp3s0 Out IP 10.8.254.25.42257 > 10.21.56.1.snmp:  F=r U="" E= C="" GetRequest(14)
13:46:54.557261 veth96d3efe P   IP 172.18.0.9.57042 > 10.21.56.1.snmp:  F=r U="" E= C="" GetRequest(14)
13:46:54.557261 br-8d71e7e6f26d In  IP 172.18.0.9.57042 > 10.21.56.1.snmp:  F=r U="" E= C="" GetRequest(14)
13:46:54.557304 enp3s0 Out IP 10.8.254.25.57042 > 10.21.56.1.snmp:  F=r U="" E= C="" GetRequest(14)
13:46:54.737243 enp3s0 In  IP 10.21.56.1.snmp > 10.8.254.25.57042:  F= U="" E=_80_00_0a_4c_01_0a_15_00_01 C="" Report(33)  S:snmpUsmMIB.usmMIBObjects.usmStats.usmStatsUnknownEngineIDs.0=1841294
13:46:54.737304 br-8d71e7e6f26d Out IP 10.21.56.1.snmp > 172.18.0.9.57042:  F= U="" E=_80_00_0a_4c_01_0a_15_00_01 C="" Report(33)  S:snmpUsmMIB.usmMIBObjects.usmStats.usmStatsUnknownEngineIDs.0=1841294
13:46:54.737316 veth96d3efe Out IP 10.21.56.1.snmp > 172.18.0.9.57042:  F= U="" E=_80_00_0a_4c_01_0a_15_00_01 C="" Report(33)  S:snmpUsmMIB.usmMIBObjects.usmStats.usmStatsUnknownEngineIDs.0=1841294
13:46:54.737714 veth96d3efe P   IP 172.18.0.9.57042 > 10.21.56.1.snmp:  F=apr U="Usymv3" [!scoped PDU]80_5e_84_83_34_04_86_70_44_5f_fc_74_76_87_0e_b1_22_96_1c_fa_ce_46_53_aa_43_60_b8_1e_83_69_84_b4_e8_3a_90_59_14_19_0c_c1_14_d9_21_b4_70_34_98_58_8d_68_c1_0a_49_a8_ea_40_18_bd_3b_d8_0a_fa_9e_67_72_f1_c1_8f_de_73_37_a6_bc_51_fe_18_25_93_03_da_cb_7c_51_a8_41_78_6e_ce_14_8e_e9_94_ad_48_0d_a9_32_0e_8e_11_c0_86_4c_79_8c_04_09_f0_72_bc_f9_a2_7b_65_f3_23_f2_b4_72_9c_5c_70_a3_bf_19_f5_5d_ba_cd_b4_c9_f7_85_96_cf_c5_69_94_5f_7f_56_59_9e_7c_75_d5_41_67_6d_a4_c1_6c_17_f2_27_7e_e1_20_14_5e_9a_c4_08_6b_ed_7e_88_40_b5_a0_95_0e_83_a5_69_89_ba_a6_41_bc_de_2a_f8_9b_ab_1a_af_69_8c_47_4c_24
13:46:54.737714 br-8d71e7e6f26d In  IP 172.18.0.9.57042 > 10.21.56.1.snmp:  F=apr U="Usymv3" [!scoped PDU]80_5e_84_83_34_04_86_70_44_5f_fc_74_76_87_0e_b1_22_96_1c_fa_ce_46_53_aa_43_60_b8_1e_83_69_84_b4_e8_3a_90_59_14_19_0c_c1_14_d9_21_b4_70_34_98_58_8d_68_c1_0a_49_a8_ea_40_18_bd_3b_d8_0a_fa_9e_67_72_f1_c1_8f_de_73_37_a6_bc_51_fe_18_25_93_03_da_cb_7c_51_a8_41_78_6e_ce_14_8e_e9_94_ad_48_0d_a9_32_0e_8e_11_c0_86_4c_79_8c_04_09_f0_72_bc_f9_a2_7b_65_f3_23_f2_b4_72_9c_5c_70_a3_bf_19_f5_5d_ba_cd_b4_c9_f7_85_96_cf_c5_69_94_5f_7f_56_59_9e_7c_75_d5_41_67_6d_a4_c1_6c_17_f2_27_7e_e1_20_14_5e_9a_c4_08_6b_ed_7e_88_40_b5_a0_95_0e_83_a5_69_89_ba_a6_41_bc_de_2a_f8_9b_ab_1a_af_69_8c_47_4c_24

**Comment by vincentbernat** [comment]
Configuration for SNMPv3 looks like this:

```
metadata:
  workers: 10
  providers:
    type: snmp
    credentials:
      ::/0:
        security-parameters:
          user-name: monitoring
          authentication-protocol: SHA
          authentication-passphrase: "d$rkSec"
          privacy-protocol: AES192
          privacy-passphrase: "Cl0se"
```

Your configuration looks correct (with SNMPv3, it's difficult to know if everything is correct as you are using privacy), but the exporter does not answer. Likely the problem is on your exporter.

Note that you are spamming a lot of discussions, pinging people with little patience. Please, be more moderate and [quote the code to make it more readable](https://docs.github.com/en/get-started/writing-on-github/getting-started-with-writing-and-formatting-on-github/basic-writing-and-formatting-syntax#quoting-code).

**Reply by chupztugz000000000** [reply]
This is the errors im now getting

<img width="1059" height="171" alt="image" src="https://github.com/user-attachments/assets/8352ba72-30d9-4c64-a6fb-40f5026b0742" />

i can also have receive 
<img width="1227" height="96" alt="image" src="https://github.com/user-attachments/assets/505a9875-91f8-4417-aa29-cb16dd119c1b" />

curl -s http://127.0.0.1:8080/api/v0/inlet/metrics | grep 'akvorado_inlet_kafka_sent_messages' - but when i run this it doesn return anything

**Reply by chupztugz000000000** [reply]
@vincentbernat  I already got going i had traffic from internal i have 1 exporter and 2 flows. but im not getting any external only internal? should i set my interface internal to external? because 1 interface im getting for internal is p2p and other is internal.? sharing you the screenshot 
<img width="1601" height="930" alt="image" src="https://github.com/user-attachments/assets/14c2a7a9-e6f1-4889-83c5-c57e6e94215c" />

**Reply by vincentbernat** [reply]
On your screenshot, I don't see the OutIf* fields.

**Reply by chupztugz000000000** [reply]
if  i monitor traffic to any interface in my firewall what could be my interface classifiers look like? can you help me? or it should be specific to a interface description and name? @vincentbernat

**Reply by chupztugz000000000** [reply]
@vincentbernat   i already had the traffic for external . but why im only getting the AS 65000? do we need the other AS to have it tell what site is the traffic right? 
<img width="1418" height="892" alt="image" src="https://github.com/user-attachments/assets/e49fdcf2-8df5-4ce8-9659-512058312d3c" />
<img width="1893" height="550" alt="image" src="https://github.com/user-attachments/assets/b85c6024-1a8b-4c98-988e-bf21bb64e99b" />
