### DISCUSSION TITLE
Can not see any flow on the Dashboard

### DISCUSSION THREAD

**Discussion by Ozz62** [akvorado/akvorado#1709] [Q&A]
Hello,
I am trying to configure an Akvorado to monitor our BGP infrastructure. I am using Bird2 as the routing daemon which is installed over a Alpine Linux Server.  I can not extract any data from Bird2 Server. 

The interface information on Bird2 Server is below.

4: rid: <BROADCAST,NOARP,UP,LOWER_UP> mtu 1500 qdisc noqueue state UNKNOWN group default qlen 1000
    link/ether 56:52:70:f5:d2:d0 brd ff:ff:ff:ff:ff:ff
    inet 10.147.0.4/32 scope global rid

My inlet.yaml file is also below. I have configured the interface name as "^(?i)(transit|rid):? ", "$1") but I didnt work. I also dont know how to configure External and Internal 

kafka:
  compression-codec: zstd
metadata:
  workers: 10
  provider:
    type: snmp
    credentials:
      ::/0:
        communities: public
flow:
  inputs:
    - type: udp
      decoder: netflow
      listen: :2055
      workers: 6
      receive-buffer: 10485760
    - type: udp
      decoder: sflow
      listen: :6343
      workers: 6
      receive-buffer: 10485760
core:
  workers: 6
  exporter-classifiers:
    # This is an example. This should be customized depending on how
    # your exporters are named.
    - ClassifySiteRegex(Exporter.Name, "^([^-]+)-", "$1")
    - ClassifyRegion("europe")
    - ClassifyTenant("acme")
    - ClassifyRole("edge")
  interface-classifiers:
    # This is an example. This must be customized depending on the
    # descriptions of your interfaces. In the following, we assume
    # external interfaces are named "Transit: Cogent" Or "IX:
    # FranceIX".
    - |
      ClassifyConnectivityRegex(Interface.Name, "^(?i)(transit|rid):? ", "$1") &&
      ClassifyProviderRegex(Interface.Description, "^\\S+?\\s(\\S+)", "$1") &&
      ClassifyExternal()
    - ClassifyInternal()
    

In the akvorado.yaml file I have identfied the IP adress of my router. 

clickhouse:
  orchestrator-url: http://akvorado-orchestrator:8080
  kafka:
    consumers: 4
  servers:
    - clickhouse:9000
  prometheus-endpoint: /metrics
  asns:
    64501: ACME Corporation
  networks:
    # You should customize this section with your networks. This
    # populates the Src/DstNetName/Role/Site/Region/Tenant fields.
    10.147.0.4/32:
      name: ipv4-spielweise
      role: Spielweise

![Screenshot 2025-03-31 083751](https://github.com/user-attachments/assets/a893d852-a17c-43ac-b689-e18e938afdda)

**Comment by fatherfbi** [comment]
If you want to take statistics from the server on which bird2 is installed. To do this, you need to configure sending a stream to the Akvorado server, bird2 cannot send sflow/netflow.

**Reply by Ozz62** [reply]
In this case Bird2 is not relevant. I have installed net-snmp on Alpine Linux Server which has Bird Routing Deamon. To crosschecked I have installed another tool and I can see that snmp is working.

I believe that I have the interface mapping not correctly configured on Akvorado in inlet.yalm file. 
I have been trying to get a flow but no matter what I have tried wasn't successful.

![bird_snmp](https://github.com/user-attachments/assets/9ffb1b96-cf69-4871-a6e8-fa8ddd4f7cc4)

**Reply by Ozz62** [reply]
Can anyone help me to get a flow from my Server ?  @fatherfbi  @vincentbernat  
I have tried to configure the Interface name in the inlet.yaml as below. 

ClassifyConnectivityRegex(Interface.Name, "^(?i)(transit|rid):? ", "$1") &&


The interface information from my Server is;

4: rid: <BROADCAST,NOARP,UP,LOWER_UP> mtu 1500 qdisc noqueue state UNKNOWN group default qlen 1000
link/ether 56:52:70:f5:d2:d0 brd ff:ff:ff:ff:ff:ff
inet 10.147.0.4/32 scope global rid

**Reply by fatherfbi** [reply]
> Can anyone help me to get a flow from my Server ? @fatherfbi @vincentbernat I have tried to configure the Interface name in the inlet.yaml as below.
> 
> ClassifyConnectivityRegex(Interface.Name, "^(?i)(transit|rid):? ", "$1") &&
> 
> The interface information from my Server is;
> 
> 4: rid: <BROADCAST,NOARP,UP,LOWER_UP> mtu 1500 qdisc noqueue state UNKNOWN group default qlen 1000 link/ether 56:52:70:f5:d2:d0 brd ff:ff:ff:ff:ff:ff inet 10.147.0.4/32 scope global rid

Is your server sending flow towards Akvorado? Can you confirm this via tcpdump in Akvorado?

**Reply by Ozz62** [reply]
[t004~# tcpdump -n -i eth0 port 2055.txt](https://github.com/user-attachments/files/19758685/t004.tcpdump.-n.-i.eth0.port.2055.txt)
I am sorry for the late response. I have installed a new Server for Akvorado. 

The IP addresses;

Alpine Linux(Bird Deamon) Eth0 IP: 10.147.1.8
Alpine Linux(Bird Deamon) rid(loopback) : 10.147.0.4
Akvorado IP: 10.147.129.34

From Bird Router to Akvorado the tcpdump netflow output is below.

t004:~ tcpdump -n -i eth0 port 2055
tcpdump: verbose output suppressed, use -v[v]... for full protocol decode
listening on eth0, link-type EN10MB (Ethernet), snapshot length 262144 bytes
13:28:37.000176 IP 10.147.0.4.53193 > 10.147.129.34.2055: UDP, length 76
13:29:02.000156 IP 10.147.0.4.53193 > 10.147.129.34.2055: UDP, length 128
13:29:07.000179 IP 10.147.0.4.53193 > 10.147.129.34.2055: UDP, length 128
13:29:37.000225 IP 10.147.0.4.53193 > 10.147.129.34.2055: UDP, length 128
13:30:02.000091 IP 10.147.0.4.53193 > 10.147.129.34.2055: UDP, length 128
13:30:07.000176 IP 10.147.0.4.53193 > 10.147.129.34.2055: UDP, length 128
13:30:42.000181 IP 10.147.0.4.53193 > 10.147.129.34.2055: UDP, length 76
13:31:07.000159 IP 10.147.0.4.53193 > 10.147.129.34.2055: UDP, length 648
13:31:07.001594 IP 10.147.0.4.53193 > 10.147.129.34.2055: UDP, length 1428
^C
9 packets captured
9 packets received by filter
0 packets dropped by kernel
t004:~

**Reply by Ozz62** [reply]
@fatherfbi  any suggestions?

**Reply by fatherfbi** [reply]
> @fatherfbi any suggestions?

Show
```
curl -s http://127.0.0.1:8080/api/v0/inlet/metrics | grep '^akvorado_inlet' | grep _error
```

**Reply by Ozz62** [reply]
@fatherfbi  Here is the output from the command;

root@akvorado-new:~ curl -s http://127.0.0.1:8080/api/v0/inlet/metrics | grep '^akvorado_inlet' | grep _error
akvorado_inlet_flow_decoder_errors_total{name="netflow"} 2
root@akvorado-new:~

In my Akvorado Server I am using Netflow.  The inlet.yaml file is below.


flow:
  inputs:
    - type: udp
      decoder: netflow
      listen: :2055
      workers: 6
      receive-buffer: 10485760
    - type: udp
      decoder: sflow
      listen: :6343
      workers: 6
      receive-buffer: 10485760
core:


I have changed the second decoder from sflow to netflow but didnt work. 

In the Documantation the below command was also recommended but still getting the same error.

root@akvorado-new:~ conntrack -D -p udp --orig-port-dst 2055
udp      17 9 src=10.147.0.4 dst=10.147.129.34 sport=53193 dport=2055 [UNREPLIED] src=172.19.0.7 dst=10.147.0.4 sport=2055 dport=53193 mark=0 use=1
conntrack v1.4.7 (conntrack-tools): 1 flow entries have been deleted.
root@akvorado-new:~ curl -s http://127.0.0.1:8080/api/v0/inlet/metrics | grep '^akvorado_inlet' | grep _error
akvorado_inlet_flow_decoder_errors_total{name="netflow"} 47
root@akvorado-new:~

**Reply by Ozz62** [reply]
@fatherfbi  did you get a chance to look the output?

**Reply by fatherfbi** [reply]
> @fatherfbi did you get a chance to look the output?

show pls
```
curl -s http://127.0.0.1:8080/api/v0/inlet/flows?limit=1
curl -s http://127.0.0.1:8080/api/v0/inlet/metrics | grep '^akvorado_inlet_flow_input_udp_packets'
curl -s http://127.0.0.1:8080/api/v0/inlet/metrics | grep '^akvorado_inlet_kafka_sent_messages_total'
```

**Reply by Ozz62** [reply]
@fatherfbi  The results are below. 

curl -s http://127.0.0.1:8080/api/v0/inlet/flows?limit=1  --> After waiting sometime I receive no output or result.
root@akvorado-new:~ # curl -s http://127.0.0.1:8080/api/v0/inlet/flows?limit=1    
^C
root@akvorado-new:~ 


root@akvorado-new:~ # curl -s http://127.0.0.1:8080/api/v0/inlet/metrics | grep '^akvorado_inlet_flow_input_udp_packets'
akvorado_inlet_flow_input_udp_packets_total{exporter="10.147.0.4",listener=":2055",worker="3"} 36093
root@akvorado-new:~ # 

root@akvorado-new:~ # curl -s http://127.0.0.1:8080/api/v0/inlet/metrics | grep '^akvorado_inlet_kafka_sent_messages_total'
root@akvorado-new:~ #

**Reply by Ozz62** [reply]
@fatherfbi  Sorry to bother you again. Any suggestion that I could use?

**Reply by fatherfbi** [reply]
> @fatherfbi Sorry to bother you again. Any suggestion that I could use?

Unfortunately, I'm out of ideas.

**Reply by Ozz62** [reply]
@fatherfbi Thank you for the help. 

@vincentbernat @azery12356  Could any of you may can  help me with the problem?
