### DISCUSSION TITLE
No SNMP from Outlet to Router

### DISCUSSION THREAD

**Discussion by nguyenpc3** [akvorado/akvorado#2372] [Q&A]
Hi all,
I'm facing a problem with SNMP at the outlet. Much appreciated your support to help me out. 

I follow the instructions to troubleshoot  when the log comes from outlet like this:
```bash
monitor@ipms:~/myt-aiops/observability_bk_ok$ curl -s http://127.0.0.1:8080/api/v0/outlet/metrics | grep 'akvorado_outlet_core.*errors'
# HELP akvorado_outlet_core_flows_errors_total Number of flows with errors.
# TYPE akvorado_outlet_core_flows_errors_total counter
akvorado_outlet_core_flows_errors_total{error="metadata missing",exporter="10.201.71.73"} 71233
monitor@ipms:~/myt-aiops/observability_bk_ok$ 
```
Following the instructions from [https://demo.akvorado.net/docs/troubleshooting#outlet](url)

_metadata missing means that interface information is missing. The most likely cause is that the exporter does not accept SNMP requests or the SNMP community is configured incorrectly._

A convenient way to check if the SNMP configuration is correct is to use ```tcpdump```. ==> I got nothing.

```bash
monitor@ipms:~/myt-aiops/observability_bk_ok$ sudo nsenter -t $(pgrep -fo "akvorado outlet") -n tcpdump -c3 -pni eth0 port 161
[sudo] password for monitor: 
tcpdump: verbose output suppressed, use -v or -vv for full protocol decode
listening on eth0, link-type EN10MB (Ethernet), capture size 262144 bytes
^C
0 packets captured
0 packets received by filter
0 packets dropped by kernel
```

If you do not get an answer, there may be several causes:

- the community is incorrect, and you need to fix it ===> I try the snmpwalk with netshoot (same network with akvorado-outlet) and it is correct SNMP String.
```
monitor@ipms:~/myt-aiops/observability_bk_ok$ docker run -it --network container:docker-akvorado-outlet-1 nicolaka/netshoot
 971b3476ffcd  ~  snmpwalk -v2c -c MyTel#2017 10.201.71.73 sysDescr
SNMPv2-MIB::sysDescr.0 = STRING: Huawei Versatile Routing Platform Software 
VRP (R) software, Version 8.230 (NE40E V800R023C00SPC500) 
Copyright (C) 2012-2023 Huawei Technologies Co., Ltd. 
HUAWEI NE40E-X8A 
```
- the exporter is not configured to answer SNMP requests ==> here is my outlet.yml

```
monitor@ipms:~/myt-aiops/observability_bk_ok$ cat config/outlet.yaml 
---
metadata:
  providers:
    - type: snmp
      credentials:
        ::/0:
          communities:
            - MyTel#2017
            - "MyTel#2017"
    
routing:
  provider:
    type: bmp
    # Before increasing this value, look for it in the troubleshooting section
    # of the documentation.
    receive-buffer: 212992
core:
  default-sampling-rate: 1000
  exporter-classifiers:
    # This is an example. This should be customized depending on how
    # your exporters are named.
    - ClassifySiteRegex(Exporter.Name, "^([^-]+)-", "$1")
    - ClassifyRegion("europe")
    - ClassifyTenant("acme")
    - ClassifyRole("edge")
  interface-classifiers:
    # This is an example. This must be customized depending on the
    # descriptions of your interfaces. In the following, we assume
    # external interfaces are named "Transit: Cogent" Or "IX:
    # FranceIX".
    - |
      ClassifyConnectivityRegex(Interface.Description, "(?i)UPSTREAM_(TRANSIT|IX|PNI)" , "$1") &&
      ClassifyProviderRegex(Interface.Description, "_TO_([A-Z0-9]+)$" , "$1") &&
      ClassifyExternal()
    - ClassifyInternal()
```

- your version of Docker is too old, check you are running Docker Engine v23 or more recent: ==> Mine is V28
```
monitor@ipms:~/myt-aiops/observability_bk_ok$ docker version -f '{{ .Server.Version }}'
28.1.1
```
--
And here is my SNMP configuration on my router. It is Huawei NE40E-X8A 

```
#
snmp-agent
snmp-agent community read cipher %^%#6z:.:vzy]%h:<<9@kHHDYlV^!T='e>xB6!#oJc[U*x%l+#4o/AEC}*.6^E+<5sqCNQ=-z=4R/|T(pGV~%^%# alias __CommunityAliasName_01_19279
#
snmp-agent sys-info version v2c v3
snmp-agent target-host host-name IPMS trap address udp-domain 10.201.222.197 params securityname cipher %^%#c4)U0]Y~g9c!Kx2AyXY-/b1qY]1^$QGY;"=\QCN4%^%# v2c private-netmanager ext-vb
#
snmp-agent mib-view included iso-view iso
#
snmp-agent trap source GigabitEthernet0/0/0
#
snmp-agent extend error-code enable
#
snmp-agent protocol source-status all-interface
snmp-agent protocol source-status ipv6 all-interface
#
undo snmp-agent proxy protocol source-status all-interface
undo snmp-agent proxy protocol source-status ipv6 all-interface
#
snmp-agent trap enable
#
```

**Comment by nguyenpc3** [comment]
@vincentbernat Im appreciated when you could take a look. 
Thanks and regards

**Comment by vincentbernat** [comment]
How long did you let tcpdump run?

**Reply by pijav** [reply]
I have the exact same problem with my Cisco ASR. No SNMP activity in tcpdump untill I force it with:
`sudo nsenter -t $(pgrep -fo "akvorado outlet") -n snmpwalk -v3 -l authPriv -u snmpwatcher -a SHA -A ***-x AES -X *** 10.255.5.11 1.3.6.1.2.1.1.5.0`
`SNMPv2-MIB::sysName.0 = STRING: LAN-RTR`

I run this command for at least 20 minutes. 


As a workaround I have added a static config:
```
metadata:
  workers: 10
  providers:
    - type: static
      exporters:
        10.255.5.11:
          name: LAN-RTR
          skip-missing-interfaces: true
          ifindexes:
            1:
                name: Te0/0/0
            2: 
                name: Te0/0/1
            131: 
                name: Tunnel84
    - type: snmp
      credentials:
        10.255.5.11:
          user-name: snmpwatcher
          authentication-protocol: SHA
          authentication-passphrase: "***"
          privacy-protocol: AES
          privacy-passphrase: "***"

```
With static config "metadata missing" error has been gone.

**Reply by pijav** [reply]
I am updating my message. After deleting static provider and leaving only snmp provider I started to see some data in tcpdump:

```
[root@s001is-netflow akvorado]# nsenter -t $(pgrep -fo "akvorado outlet") -n tcpdump -c3 -pni eth0 port 161
dropped privs to tcpdump
tcpdump: verbose output suppressed, use -v[v]... for full protocol decode
listening on eth0, link-type EN10MB (Ethernet), snapshot length 262144 bytes
16:15:12.059718 IP 247.16.14.11.41472 > 10.255.5.11.snmp:  F=r U="" E= C="" GetRequest(14) 
16:15:12.059818 IP 247.16.14.11.58655 > 10.255.5.11.snmp:  F=r U="" E= C="" GetRequest(14) 
16:15:12.059892 IP 247.16.14.11.53084 > 10.255.5.11.snmp:  F=r U="" E= C="" GetRequest(14) 
```

It seems that there is no any useful information as SNMPv3 is encrypting the message. 
The strangiest part is that I cant see any interface names excpet for the one that I previously deleted from static provider
<img width="1437" height="360" alt="image" src="https://github.com/user-attachments/assets/d3dd5fb4-3386-466a-9c75-536d60532a89" />

**Reply by vincentbernat** [reply]
I think what is expected is to have some engine ID discovery. Can you capture with tcpdump what happens when you use `snmpwalk` instead?

**Reply by pijav** [reply]
Hi Vincent, thank you for paying attention and responding to me

With:
`nsenter -t $(pgrep -fo "akvorado outlet") -n snmpwalk -v3 -l authPriv -u snmpwatcher -a SHA -A ***-x AES -X *** 10.254.4.11 1.3.6.1.2.1.1.5.0`

I get:
```
[root@s001is-netflow root]# nsenter -t $(pgrep -fo "akvorado outlet") -n tcpdump -c3 -pni eth0 port 161
dropped privs to tcpdump
tcpdump: verbose output suppressed, use -v[v]... for full protocol decode
listening on eth0, link-type EN10MB (Ethernet), snapshot length 262144 bytes
11:26:15.280916 IP 247.16.14.10.36992 > 10.254.4.11.snmp:  F=r U="" E= C="" GetRequest(14) 
11:26:15.282340 IP 10.254.4.11.snmp > 247.16.14.10.36992:  F= U="" E=_80_00_00_09_03_00_cc_16_7e_af_a0_00 C="" Report(34)  .1.3.6.1.6.3.15.1.1.4.0=82181605
11:26:15.282485 IP 247.16.14.10.36992 > 10.254.4.11.snmp:  F=apr U="snmpwatcher" [!scoped PDU]0f_cd_97_bd_66_cd_7a_f5_ea_eb_aa_aa_01_34_51_06_c7_07_87_49_81_d3_75_53_89_27_7e_af_f7_f8_90_ff_64_c4_98_f5_0d_cc_f7_4d_4e_2e_e8_66_8c_e9_ba_3a
3 packets captured
6 packets received by filter
0 packets dropped by kernel
```

**Reply by vincentbernat** [reply]
I don't see why this behaves differently. Can you capture the packets to a file with `-w XXX.pcap` so that we compare the two packets?

**Reply by pijav** [reply]
Hello @vincentbernat 

I tried two exeperiments
1. Manual SNMP with snmpwalk with snmpv3
The snmpwalk cmmand:
```
[root@netflow root]# nsenter -t $(pgrep -fo "akvorado outlet") -n snmpwalk -v3 -l authPriv -u snmpwatcher -a SHA -A *** -x AES -X *** 10.254.4.11 1.3.6.1.2.1.2.2.1.1
IF-MIB::ifIndex.1 = INTEGER: 1
IF-MIB::ifIndex.2 = INTEGER: 2
IF-MIB::ifIndex.3 = INTEGER: 3
IF-MIB::ifIndex.4 = INTEGER: 4
IF-MIB::ifIndex.5 = INTEGER: 5
...the other output is omitted to save some space

```
The pcap command:
`nsenter -t $(pgrep -fo "akvorado outlet") -n tcpdump -c30 -pni eth0 port 161 -w manu.pcap `

2. nonManual (with the application itself):
`nsenter -t $(pgrep -fo "akvorado outlet") -n tcpdump -c30 -pni eth0 port 161 -w auto.pcap`

The result is here:
[pcap.zip](https://github.com/user-attachments/files/27125306/pcap.zip)

**Reply by vincentbernat** [reply]
I see that in auto.pcap, it sometimes work, sometimes not. Maybe the "engine probing" is rate limited on the target device. What kind of router is your target device? Also, it seems that the engine is not cached.

**Reply by vincentbernat** [reply]
I have "fixed" this in ce4c585cffa0. Could you try with Docker image "main"? If it still does not work, the same kind of packet capture would help.

**Reply by pijav** [reply]
> I have "fixed" this in [ce4c585](https://github.com/akvorado/akvorado/commit/ce4c585cffa007ababa641115c029d41364e385b). Could you try with Docker image "main"? If it still does not work, the same kind of packet capture would help.

We completely reinstalled the application and tried again with no positive result. The interesting part is that if I do static config and then change it to snmp I still can see hardcoded interface names in flows from Akvorado
[auto2.zip](https://github.com/user-attachments/files/27207467/auto2.zip)
<img width="948" height="566" alt="image" src="https://github.com/user-attachments/assets/66df2ead-6a9e-45a3-9dc3-495378e3fa8e" />

**Reply by vincentbernat** [reply]
There is 60-minute cache, even when using a static configuration. I suppose that's why you continue to see value.

So, looking more closely at the capture, it still fails and the probe engine is still done each time since we cannot get a successful result. Once we get the engine ID, the first query is refused with usmStatsWrongDigests as a report. It could be a wrong auth or priv key. But since you tried with snmpwalk and it works, I have no clue.

Can you try to tcpdump directly on the host instead and restart the outlet. Maybe the first requests are OK, but then there is a failure when caching the engine IDs.
