### DISCUSSION TITLE
No Flows on the UI and error unable to GET (7 OIDs)

### DISCUSSION THREAD

**Discussion by iirteza** [akvorado/akvorado#1500] [Q&A] [answered]
Hi Team and @vincentbernat 

First of all a super tool, easy to use and quick start setup. We had a discussion in our internal team and we might be using this in a production setup for better router and traffic analysis for our hosting company. 

A team member is sending netflow from a cisco router. I've used snmpv2 and snmpv3 with correct security parameters but still no result. Here are few issues I'm running into:

Seeing an error: 

("level": "error", "error":"request timeout (after 1 retries)", "exporter":"68.xx","time":"2824-11-12T17:49:59Z","caller" : "akvorado/inlet/metadata/provider/snmp/poller.go:115","module":"akvorado/inlet/metadata/provider/snmp", "message":"**unable to GET (7 OIDs)**"}
("level": "error", "error":"request timeout (after 1 retries)", "exporter":"68.","time":"2824-11-12T17:50:02Z","caller":"akvorado/inlet/metadata/provider/snmp/poller.go:115","module":"akvorado/inlet/metadata/provider/snmp", "message":"**unable to GET (7 OIDs)**"}

_applied the following fix but it didn't work._ 

{
 "default-address-pools": [{"base":"240.0.0.0/16","size":24}],
 "userland-proxy": false
}

Also seeing the received packet with following message. Not sure what's wrong. Any help is highly appreciated. 

17:55:07.643567 IP (tos exe, ttl 255, id 59226, offset 0, flags (none), proto UDP (17), length 120) 68.xx.3264 10.20.5.61.6343: [no cksum] sFlow version 589825 packet not supported 17:55:08.643687 IP (tos exe, ttl 255, id 59227, offset 0, flags [none], proto UDP (17), length 188) 68.xx.3264 10.20.5.61.6343: [no cksum] sFlow version 589826 packet not supported

**Comment by vincentbernat** [comment]
Is the exporter address correct in the error message? If yes, did you configure the right community? You can check with tcpdump on port 161 what SNMP requests are sent to the exporters.

**Reply by iirteza** [reply]
Thank you for the quick response.

I updated my community settings in inlet.yml as below:

kafka:
compression-codec: zstd
metadata:
workers: 10
provider:
type: snmp
communities:
10.20.5.16/32: 8954MKBQhjw****

10.20.5.16 is the exporter IP but akvorado is showing receiving flows from 68.209.*** a different IP. When I ran snmpwalk on this IP it fails but not on 10.20.5.16, I can map this IP in inlet.yaml under agents.

But I'm still seeing same OIDs error and following errors and are increasing:

"level":"error","error":"request timeout (after 1 retries)","exporter":"68.xx","time":"2024-11-13T20:38:02Z","caller":"akvorado/inlet/metadata/provider/snmp/poller.go:115","module":"akvorado_inlet_metadata_provider_snmp","message":"unable to GET (7 OIDs)"
akvorado_inlet_core_flows_errors_total{error="SNMP cache miss", exporter="68.xx"} 14
akvorado_inlet_flow_decoder_netflow_errors_total{error="NetFlow v9 decoding error", exporter="68.xx"} 133
"level":"error","error":"request timeout (after 1 retries)","exporter":"68.xx","time":"2024-11-13T20:38:25Z","caller":"akvorado/common/httpserver/root.go:88","module":"akvorado_inlet_metadata_provider_snmp","message":"HTTP request"

Thanks again for your help.

**Reply by vincentbernat** [reply]
Check with tcpdump the SNMP requests that are being generated and if they are being answered or not. Something like `tcpdump -pni any port 161` should be enough.

**Reply by iirteza** [reply]
08:40:12.013760 IP 240.0.23.4.65237 > 68.**.161: GetRequest(131)   1.3.6.1.2.1.5.0
08:40:12.013765 IP 10.20.**.65237 > 68.**.161: GetRequest(131)   1.3.6.1.2.1.5.0
08:40:12.013766 IP 240.0.23.4.65237 > 68.**.161: GetRequest(131)   1.3.6.1.2.1.31.1.1.18.59
08:40:12.013770 IP 10.20.**.65237 > 68.**.161: GetRequest(131   1.3.6.1.2.1.31.1.1.18.59

I don't see any GetResponse. However it started working when community set to public for 3 days but again stopped without any reason. Now I'm seeing SNMP Cache miss error and Unable to GET errors again however no change in the settings on router or akvorado server side.

Thanks for your help.

**Reply by vincentbernat** [reply, marked as answer]
Likely the SNMP community is not configured correctly. Use `-vv` to get more details from tcpdump.

**Reply by iirteza** [reply]
Thank you for your help. I was sucessfully able to configure exporters. Even when I have flows I don't see anything

Here's another Issue, I'm not able to see any stats on homepage, like TOP Source AS, most used port etc
![112](https://github.com/user-attachments/assets/f5598047-b50e-4aa3-8244-f0c445030427)

Anything I can do for this?

Many Thanks

**Reply by gonzaleztroyano** [reply]
Hello. I'm unable to solve this same problem:
```
akvorado-inlet-1  | {"level":"error","error":"request timeout (after 1 retries)","exporter":"10.200.200.1","time":"2025-08-17T13:52:04Z","caller":"akvorado/inlet/metadata/provider/snmp/poller.go:119","module":"akvorado/inlet/metadata/provider/snmp","message":"unable to GET (17 OIDs)"}
akvorado-inlet-1  | {"level":"error","error":"request timeout (after 1 retries)","exporter":"10.200.200.1","time":"2025-08-17T13:52:08Z","caller":"akvorado/inlet/metadata/provider/snmp/poller.go:119","module":"akvorado/inlet/metadata/provider/snmp","message":"unable to GET (5 OIDs)"}
akvorado-inlet-1  | {"level":"error","error":"request timeout (after 1 retries)","exporter":"10.200.200.1","time":"2025-08-17T13:52:08Z","caller":"akvorado/inlet/metadata/provider/snmp/poller.go:119","module":"akvorado/inlet/metadata/provider/snmp","message":"unable to GET (13 OIDs)"}
akvorado-inlet-1  | {"level":"error","error":"request timeout (after 1 retries)","exporter":"10.200.200.1","time":"2025-08-17T13:52:15Z","caller":"akvorado/inlet/metadata/provider/snmp/poller.go:119","module":"akvorado/inlet/metadata/provider/snmp","message":"unable to GET (5 OIDs)"}
akvorado-inlet-1  | {"level":"error","error":"request timeout (after 1 retries)","exporter":"10.200.200.1","time":"2025-08-17T13:52:15Z","caller":"akvorado/inlet/metadata/provider/snmp/poller.go:119","module":"akvorado/inlet/metadata/provider/snmp","message":"unable to GET (9 OIDs)"}
akvorado-inlet-1  | {"level":"error","error":"request timeout (after 1 retries)","exporter":"10.200.200.1","time":"2025-08-17T13:52:15Z","caller":"akvorado/inlet/metadata/provider/snmp/poller.go:119","module":"akvorado/inlet/metadata/provider/snmp","message":"unable to GET (9 OIDs)"}
```

If I try with snmpwalk, all info is provided without problem, so it doesn't look like a connectivity problem.

This is my configuration on file `config/inlet.yaml`:
```yaml
snmp:
  workers: 4
  communities:
    ::/0: xxxxxxxx
  poller-timeout: 120
  poller-retries: 1
  cache-duration: 10m
  cache-refresh: 10m
  cache-check-interval: 5m
```

Any ideas? @iirteza @vincentbernat 
Thanks!

**Reply by vincentbernat** [reply]
Check with tcpdump. See https://demo.akvorado.net/docs/troubleshooting for the commands. Beware this is the documentation about the next version. In the current version, there is no outlet service.

**Reply by gonzaleztroyano** [reply]
Hello:

Thanks in advance for your help, Vincent.

## Curl API details

I can see inlet flows:
```cmd
curl -s http://127.0.0.1:8080/api/v0/inlet/metrics | grep 'akvorado_inlet_flow_input_udp_packets'
akvorado_inlet_flow_input_udp_packets_total{exporter="10.200.200.1",listener=":2055",worker="5"} 2310
```



<details>
<summary>Kafka details</summary>

```
root@monitor:# curl -s http://127.0.0.1:8080/api/v0/inlet/metrics | grep 'akvorado_inlet_kafka'

akvorado_inlet_kafka_brokers_incoming_byte_rate{broker="1001"} 3.9354708888213716
akvorado_inlet_kafka_brokers_inflight_requests{broker="1001"} 0
akvorado_inlet_kafka_brokers_outgoing_byte_rate{broker="1001"} 0.08468437059029855
akvorado_inlet_kafka_brokers_request_latency_ms_bucket{broker="1001",le="0.5"} 0
akvorado_inlet_kafka_brokers_request_latency_ms_bucket{broker="1001",le="0.9"} 0
akvorado_inlet_kafka_brokers_request_latency_ms_bucket{broker="1001",le="0.99"} 1
akvorado_inlet_kafka_brokers_request_latency_ms_bucket{broker="1001",le="+Inf"} 14
akvorado_inlet_kafka_brokers_request_latency_ms_sum{broker="1001"} 1
akvorado_inlet_kafka_brokers_request_latency_ms_count{broker="1001"} 14
akvorado_inlet_kafka_brokers_request_rate{broker="1001"} 0.0023523436275082925
akvorado_inlet_kafka_brokers_request_size_bucket{broker="1001",le="0.5"} 36
akvorado_inlet_kafka_brokers_request_size_bucket{broker="1001",le="0.9"} 39
akvorado_inlet_kafka_brokers_request_size_bucket{broker="1001",le="0.99"} 43
akvorado_inlet_kafka_brokers_request_size_bucket{broker="1001",le="+Inf"} 14
akvorado_inlet_kafka_brokers_request_size_sum{broker="1001"} 511
akvorado_inlet_kafka_brokers_request_size_count{broker="1001"} 14
akvorado_inlet_kafka_brokers_response_bytes_bucket{broker="1001",le="0.5"} 1673
akvorado_inlet_kafka_brokers_response_bytes_bucket{broker="1001",le="0.9"} 1673
akvorado_inlet_kafka_brokers_response_bytes_bucket{broker="1001",le="0.99"} 1673
akvorado_inlet_kafka_brokers_response_bytes_bucket{broker="1001",le="+Inf"} 14
akvorado_inlet_kafka_brokers_response_bytes_sum{broker="1001"} 22209
akvorado_inlet_kafka_brokers_response_bytes_count{broker="1001"} 14
akvorado_inlet_kafka_brokers_response_rate{broker="1001"} 0.0023523436275082925
```

</details>
## TCPdump

Netflow packets are reaching the host and the docker containers, as seen on the `tcpdump -pni any  port 2055` command output:
```
15:34:03.739868 enX0  In  IP 10.200.200.1.40827 > 10.200.200.74.2055: UDP, length 1364
15:34:03.739890 br-6c1d123aeb5a Out IP 10.200.200.1.40827 > 172.18.0.9.2055: UDP, length 1364
15:34:03.739893 veth6ae84bd Out IP 10.200.200.1.40827 > 172.18.0.9.2055: UDP, length 1364
15:34:05.309935 enX0  In  IP 10.200.200.1.40827 > 10.200.200.74.2055: UDP, length 1404
15:34:05.309956 br-6c1d123aeb5a Out IP 10.200.200.1.40827 > 172.18.0.9.2055: UDP, length 1404
15:34:05.309960 veth6ae84bd Out IP 10.200.200.1.40827 > 172.18.0.9.2055: UDP, length 1404
```

I also share tcpdump as viewed by SNMP router (Unifi UDM-PRO):
<details>
<summary>Click to expand Flow 2</summary>

```
16:51:04.024086 switch0 P   IP8 (invalid)
16:51:04.024086 switch0.200 P   IP (tos 0x0, ttl 63, id 17920, offset 0, flags [DF], proto UDP (17), length 286)
    10.200.200.74.47022 > 10.200.200.1.161: [udp sum ok]  { SNMPv2c C="xxxx" { GetRequest(230) R=345718517  .1.3.6.1.2.1.1.5.0 .1.3.6.1.2.1.2.2.1.2.118 .1.3.6.1.2.1.31.1.1.1.1.118 .1.3.6.1.2.1.31.1.1.1.18.118 .1.3.6.1.2.1.31.1.1.1.15.118 .1.3.6.1.2.1.2.2.1.2.45 .1.3.6.1.2.1.31.1.1.1.1.45 .1.3.6.1.2.1.31.1.1.1.18.45 .1.3.6.1.2.1.31.1.1.1.15.45 .1.3.6.1.2.1.2.2.1.2.42 .1.3.6.1.2.1.31.1.1.1.1.42 .1.3.6.1.2.1.31.1.1.1.18.42 .1.3.6.1.2.1.31.1.1.1.15.42 } }
16:51:04.024086 br200 In  IP (tos 0x0, ttl 63, id 17920, offset 0, flags [DF], proto UDP (17), length 286)
    10.200.200.74.47022 > 10.200.200.1.161: [udp sum ok]  { SNMPv2c C="xxx" { GetRequest(230) R=345718517  .1.3.6.1.2.1.1.5.0 .1.3.6.1.2.1.2.2.1.2.118 .1.3.6.1.2.1.31.1.1.1.1.118 .1.3.6.1.2.1.31.1.1.1.18.118 .1.3.6.1.2.1.31.1.1.1.15.118 .1.3.6.1.2.1.2.2.1.2.45 .1.3.6.1.2.1.31.1.1.1.1.45 .1.3.6.1.2.1.31.1.1.1.18.45 .1.3.6.1.2.1.31.1.1.1.15.45 .1.3.6.1.2.1.2.2.1.2.42 .1.3.6.1.2.1.31.1.1.1.1.42 .1.3.6.1.2.1.31.1.1.1.18.42 .1.3.6.1.2.1.31.1.1.1.15.42 } }
16:51:04.025018 br200 Out IP (tos 0x0, ttl 64, id 28281, offset 0, flags [DF], proto UDP (17), length 331)
    10.200.200.1.161 > 10.200.200.74.47022: [udp sum ok]  { SNMPv2c C="xxxxx" { GetResponse(273) R=345718517  .1.3.6.1.2.1.1.5.0="UDM-Pro-Pablo" .1.3.6.1.2.1.2.2.1.2.118="ppp0" .1.3.6.1.2.1.31.1.1.1.1.118="ppp0" .1.3.6.1.2.1.31.1.1.1.18.118="" .1.3.6.1.2.1.31.1.1.1.15.118=0 .1.3.6.1.2.1.2.2.1.2.45="br200" .1.3.6.1.2.1.31.1.1.1.1.45="br200" .1.3.6.1.2.1.31.1.1.1.18.45="" .1.3.6.1.2.1.31.1.1.1.15.45=0 .1.3.6.1.2.1.2.2.1.2.42="br10" .1.3.6.1.2.1.31.1.1.1.1.42="br10" .1.3.6.1.2.1.31.1.1.1.18.42="" .1.3.6.1.2.1.31.1.1.1.15.42=0 } }
16:51:04.025029 switch0.200 Out IP (tos 0x0, ttl 64, id 28281, offset 0, flags [DF], proto UDP (17), length 331)
    10.200.200.1.161 > 10.200.200.74.47022: [udp sum ok]  { SNMPv2c C="xxxxx" { GetResponse(273) R=345718517  .1.3.6.1.2.1.1.5.0="UDM-Pro-Pablo" .1.3.6.1.2.1.2.2.1.2.118="ppp0" .1.3.6.1.2.1.31.1.1.1.1.118="ppp0" .1.3.6.1.2.1.31.1.1.1.18.118="" .1.3.6.1.2.1.31.1.1.1.15.118=0 .1.3.6.1.2.1.2.2.1.2.45="br200" .1.3.6.1.2.1.31.1.1.1.1.45="br200" .1.3.6.1.2.1.31.1.1.1.18.45="" .1.3.6.1.2.1.31.1.1.1.15.45=0 .1.3.6.1.2.1.2.2.1.2.42="br10" .1.3.6.1.2.1.31.1.1.1.1.42="br10" .1.3.6.1.2.1.31.1.1.1.18.42="" .1.3.6.1.2.1.31.1.1.1.15.42=0 } }
```

</details>

<details>
<summary>Click to expand Flow 2</summary>

```
17:07:45.064247 switch0 P   IP8 (invalid)
17:07:45.064247 switch0.200 P   IP (tos 0x0, ttl 63, id 25400, offset 0, flags [DF], proto UDP (17), length 149)
    10.200.200.74.50335 > 10.200.200.1.161: [udp sum ok]  { SNMPv2c C="xxxxx" { GetRequest(95) R=1715549676  .1.3.6.1.2.1.1.5.0 .1.3.6.1.2.1.2.2.1.2.15 .1.3.6.1.2.1.31.1.1.1.1.15 .1.3.6.1.2.1.31.1.1.1.18.15 .1.3.6.1.2.1.31.1.1.1.15.15 } }
17:07:45.064247 br200 In  IP (tos 0x0, ttl 63, id 25400, offset 0, flags [DF], proto UDP (17), length 149)
    10.200.200.74.50335 > 10.200.200.1.161: [udp sum ok]  { SNMPv2c C="xxxxx" { GetRequest(95) R=1715549676  .1.3.6.1.2.1.1.5.0 .1.3.6.1.2.1.2.2.1.2.15 .1.3.6.1.2.1.31.1.1.1.1.15 .1.3.6.1.2.1.31.1.1.1.18.15 .1.3.6.1.2.1.31.1.1.1.15.15 } }
17:07:45.064817 br200 Out IP (tos 0x0, ttl 64, id 10310, offset 0, flags [DF], proto UDP (17), length 170)
    10.200.200.1.161 > 10.200.200.74.50335: [udp sum ok]  { SNMPv2c C="xxxxx" { GetResponse(115) R=1715549676  .1.3.6.1.2.1.1.5.0="UDM-Pro-Pablo" .1.3.6.1.2.1.2.2.1.2.15="br0" .1.3.6.1.2.1.31.1.1.1.1.15="br0" .1.3.6.1.2.1.31.1.1.1.18.15="" .1.3.6.1.2.1.31.1.1.1.15.15=0 } }
17:07:45.064829 switch0.200 Out IP (tos 0x0, ttl 64, id 10310, offset 0, flags [DF], proto UDP (17), length 170)
    10.200.200.1.161 > 10.200.200.74.50335: [udp sum ok]  { SNMPv2c C="xxxxx" { GetResponse(115) R=1715549676  .1.3.6.1.2.1.1.5.0="UDM-Pro-Pablo" .1.3.6.1.2.1.2.2.1.2.15="br0" .1.3.6.1.2.1.31.1.1.1.1.15="br0" .1.3.6.1.2.1.31.1.1.1.18.15="" .1.3.6.1.2.1.31.1.1.1.15.15=0 } }

```

</details>

## The akvorado-inlet containers logs:

<details>
<summary>Click to expand logs</summary>

```
akvorado-inlet-1  | 2025-08-17T15:07:16.421833576Z {"level":"info","handler":"/api/","method":"GET","url":"/api/v0/healthcheck","ip":"[::1]:51388","user-agent":"Go-http-client/1.1","status":200,"size":230,"duration":0.095741,"time":"2025-08-17T15:07:16Z","caller":"akvorado/common/httpserver/root.go:88","module":"akvorado/common/httpserver","message":"HTTP request"}
akvorado-inlet-1  | 2025-08-17T15:07:34.289332152Z {"level":"error","error":"request timeout (after 1 retries)","exporter":"10.200.200.1","time":"2025-08-17T15:07:34Z","caller":"akvorado/inlet/metadata/provider/snmp/poller.go:119","module":"akvorado/inlet/metadata/provider/snmp","message":"unable to GET (9 OIDs)"}
akvorado-inlet-1  | 2025-08-17T15:07:34.289367889Z {"level":"error","error":"request timeout (after 1 retries)","exporter":"10.200.200.1","time":"2025-08-17T15:07:34Z","caller":"akvorado/inlet/metadata/provider/snmp/poller.go:119","module":"akvorado/inlet/metadata/provider/snmp","message":"unable to GET (9 OIDs)"}
akvorado-inlet-1  | 2025-08-17T15:07:34.289381194Z {"level":"error","error":"request timeout (after 1 retries)","exporter":"10.200.200.1","time":"2025-08-17T15:07:34Z","caller":"akvorado/inlet/metadata/provider/snmp/poller.go:119","module":"akvorado/inlet/metadata/provider/snmp","message":"unable to GET (5 OIDs)"}
akvorado-inlet-1  | 2025-08-17T15:07:36.491110637Z {"level":"info","handler":"/api/","method":"GET","url":"/api/v0/healthcheck","ip":"[::1]:49238","user-agent":"Go-http-client/1.1","status":200,"size":230,"duration":0.1615,"time":"2025-08-17T15:07:36Z","caller":"akvorado/common/httpserver/root.go:88","module":"akvorado/common/httpserver","message":"HTTP request"}
akvorado-inlet-1  | 2025-08-17T15:07:45.049324195Z {"level":"error","error":"request timeout (after 1 retries)","exporter":"10.200.200.1","time":"2025-08-17T15:07:45Z","caller":"akvorado/inlet/metadata/provider/snmp/poller.go:119","module":"akvorado/inlet/metadata/provider/snmp","message":"unable to GET (9 OIDs)"}
akvorado-inlet-1  | 2025-08-17T15:07:45.049352193Z {"level":"error","error":"request timeout (after 1 retries)","exporter":"10.200.200.1","time":"2025-08-17T15:07:45Z","caller":"akvorado/inlet/metadata/provider/snmp/poller.go:119","module":"akvorado/inlet/metadata/provider/snmp","message":"unable to GET (5 OIDs)"}
akvorado-inlet-1  | 2025-08-17T15:07:45.049366205Z {"level":"error","error":"request timeout (after 1 retries)","exporter":"10.200.200.1","time":"2025-08-17T15:07:45Z","caller":"akvorado/inlet/metadata/provider/snmp/poller.go:119","module":"akvorado/inlet/metadata/provider/snmp","message":"unable to GET (5 OIDs)"}
akvorado-inlet-1  | 2025-08-17T15:07:48.309152533Z {"level":"warn","exporter":"10.200.200.1","time":"2025-08-17T15:07:48Z","caller":"akvorado/inlet/metadata/root.go:320","module":"akvorado/inlet/metadata","message":"provider breaker open"}
akvorado-inlet-1  | 2025-08-17T15:07:56.566064813Z {"level":"info","handler":"/api/","method":"GET","url":"/api/v0/healthcheck","ip":"[::1]:45458","user-agent":"Go-http-client/1.1","status":200,"size":230,"duration":0.192384,"time":"2025-08-17T15:07:56Z","caller":"akvorado/common/httpserver/root.go:88","module":"akvorado/common/httpserver","message":"HTTP request"}
akvorado-inlet-1  | 2025-08-17T15:08:16.636047236Z {"level":"info","handler":"/api/","method":"GET","url":"/api/v0/healthcheck","ip":"[::1]:37044","user-agent":"Go-http-client/1.1","status":200,"size":230,"duration":0.438576,"time":"2025-08-17T15:08:16Z","caller":"akvorado/common/httpserver/root.go:88","module":"akvorado/common/httpserver","message":"HTTP request"}
akvorado-inlet-1  | 2025-08-17T15:08:36.751450735Z {"level":"info","handler":"/api/","method":"GET","url":"/api/v0/healthcheck","ip":"[::1]:53302","user-agent":"Go-http-client/1.1","status":200,"size":230,"duration":0.170067,"time":"2025-08-17T15:08:36Z","caller":"akvorado/common/httpserver/root.go:88","module":"akvorado/common/httpserver","message":"HTTP request"}
akvorado-inlet-1  | 2025-08-17T15:08:46.589367671Z {"level":"error","error":"request timeout (after 1 retries)","exporter":"10.200.200.1","time":"2025-08-17T15:08:46Z","caller":"akvorado/inlet/metadata/provider/snmp/poller.go:119","module":"akvorado/inlet/metadata/provider/snmp","message":"unable to GET (5 OIDs)"}
akvorado-inlet-1  | 2025-08-17T15:08:46.589556988Z {"level":"error","error":"request timeout (after 1 retries)","exporter":"10.200.200.1","time":"2025-08-17T15:08:46Z","caller":"akvorado/inlet/metadata/provider/snmp/poller.go:119","module":"akvorado/inlet/metadata/provider/snmp","message":"unable to GET (5 OIDs)"}
akvorado-inlet-1  | 2025-08-17T15:08:46.590779880Z {"level":"error","error":"request timeout (after 1 retries)","exporter":"10.200.200.1","time":"2025-08-17T15:08:46Z","caller":"akvorado/inlet/metadata/provider/snmp/poller.go:119","module":"akvorado/inlet/metadata/provider/snmp","message":"unable to GET (17 OIDs)"}
akvorado-inlet-1  | 2025-08-17T15:08:50.109303823Z {"level":"warn","exporter":"10.200.200.1","time":"2025-08-17T15:08:50Z","caller":"akvorado/inlet/metadata/root.go:320","module":"akvorado/inlet/metadata","message":"provider breaker open"}
```
</details>

Thanks for your help!

**Reply by vincentbernat** [reply]
Are you able to snmpwalk from within the inlet container? Add "nsenter -t $(pgrep -f "akvorado inlet") -n" in front of your snmpwalk command.

**Reply by gonzaleztroyano** [reply]
Hello and thanks again.

Yes, I'm able to snmpwalk:

```
root@monitor:/# nsenter -t $(pgrep -f "akvorado inlet") -n snmpwalk -v2c -c xxxx 10.200.200.1 | head -n 10
iso.3.6.1.2.1.1.1.0 = STRING: "Ubiquiti UniFi UDM-Pro 4.1.22 Linux 4.19.152 al324"
iso.3.6.1.2.1.1.2.0 = OID: iso.3.6.1.4.1.8072.3.2.10
iso.3.6.1.2.1.1.3.0 = Timeticks: (169726360) 19 days, 15:27:43.60
iso.3.6.1.2.1.1.4.0 = STRING: "contact"
iso.3.6.1.2.1.1.5.0 = STRING: "UDM-Pro"
iso.3.6.1.2.1.1.6.0 = STRING: "location"
iso.3.6.1.2.1.1.8.0 = Timeticks: (0) 0:00:00.00
iso.3.6.1.2.1.1.9.1.2.1 = OID: iso.3.6.1.6.3.10.3.1.1
iso.3.6.1.2.1.1.9.1.2.2 = OID: iso.3.6.1.6.3.11.3.1.1
iso.3.6.1.2.1.1.9.1.2.3 = OID: iso.3.6.1.6.3.15.2.1.1

```

**Reply by vincentbernat** [reply]
It looks like maybe the error is not permanent. Can you share all the inlet metrics for metadata?
```
curl -s http://127.0.0.1:8080/api/v0/inlet/metrics | grep '^akvorado_inlet_metadata'
```

**Reply by gonzaleztroyano** [reply]
Sure:

```
root@monitor:/home/pablo# curl -s http://127.0.0.1:8080/api/v0/inlet/metrics | grep '^akvorado_inlet_metadata'
akvorado_inlet_metadata_cache_expired_entries_total 0
akvorado_inlet_metadata_cache_hits_total 0
akvorado_inlet_metadata_cache_misses_total 879634
akvorado_inlet_metadata_cache_refresh_runs_total 261
akvorado_inlet_metadata_cache_refreshs 0
akvorado_inlet_metadata_cache_size_entries 0
akvorado_inlet_metadata_provider_batched_requests_total 878506
akvorado_inlet_metadata_provider_breaker_opens_total{exporter="10.200.200.1"} 82933
akvorado_inlet_metadata_provider_snmp_poller_error_requests_total{error="get",exporter="10.200.200.1"} 14818
akvorado_inlet_metadata_provider_snmp_poller_pending_requests 0
akvorado_inlet_metadata_provider_snmp_poller_retry_requests_total{exporter="10.200.200.1"} 29636
```

I've no output from `curl -s http://127.0.0.1:8080/api/v0/inlet/flows\?limit=1`

Thanks!

**Reply by vincentbernat** [reply]
That's odd. Let's do the tcdpump from the inlet too:
```
nsenter -t $(pgrep -f "akvorado inlet") -n tcpdump -vpni eth0 -c 10 port 161
```
