### DISCUSSION TITLE
After Uprgade from old release to Akvorado 2.4.0 data is missing

### DISCUSSION THREAD

**Discussion by alifgufron** [akvorado/akvorado#2471] [Q&A]
Hello everyone, I have an issue after I upgraded Debian, Docker and Akvorado to 2.4.0. The data is not displayed. Previously there was a problem with the exporter not being read and only being read in the inlet was only IP `247.16.14.1` bridge docker akvorado.

Docker Version:
```
Docker Compose version v5.1.3
Docker version 29.5.0, build 98f1464
```

Exporter RouterOS V7 and Cisco IOS ASR1000

```
# curl -s http://127.0.0.1:8080/api/v0/inlet/metrics | grep 'akvorado_inlet_flow_input_udp_packets'
# HELP akvorado_inlet_flow_input_udp_packets_total Packets received by the application.
# TYPE akvorado_inlet_flow_input_udp_packets_total counter
akvorado_inlet_flow_input_udp_packets_total{exporter="247.16.14.1",listener=":2055",worker="0"} 32154
```

After reading the issue [#2431](https://github.com/akvorado/akvorado/issues/2431)  and run the command `conntrack -D -p udp --orig-port-dst 2055` inlet flow from exporter appears

```
vm-avocado:~# curl -s http://127.0.0.1:8080/api/v0/inlet/metrics | grep 'akvorado_inlet_flow_input_udp_packets'
# HELP akvorado_inlet_flow_input_udp_packets_total Packets received by the application.
# TYPE akvorado_inlet_flow_input_udp_packets_total counter
akvorado_inlet_flow_input_udp_packets_total{exporter="202.138.*.*",listener=":2055",worker="0"} 1.3296013e+07
akvorado_inlet_flow_input_udp_packets_total{exporter="202.138.*.*",listener=":2055",worker="1"} 1.774133e+06
akvorado_inlet_flow_input_udp_packets_total{exporter="202.138.*.*",listener=":2055",worker="3"} 93
akvorado_inlet_flow_input_udp_packets_total{exporter="247.16.14.1",listener=":2055",worker="0"} 32154
```

and Check the various tabs (brokers, topics, and consumers) from kafka UI everything is green.

check the SNMP not show response anything but manual SNMP itworks
```
vm-avocado:~# nsenter -t $(pgrep -fo "akvorado outlet") -n tcpdump -c3 -pni eth0 port 161
tcpdump: verbose output suppressed, use -v[v]... for full protocol decode
listening on eth0, link-type EN10MB (Ethernet), snapshot length 262144 bytes
11:55:59.857733 IP 247.16.14.9.44222 > 202.138.*.*.161:  C="public" GetRequest(95)  .1.3.6.1.2.1.1.5.0 .1.3.6.1.2.1.2.2.1.2.85 .1.3.6.1.2.1.31.1.1.1.1.85 .1.3.6.1.2.1.31.1.1.1.18.85 .1.3.6.1.2.1.31.1.1.1.15.85
11:55:59.857916 IP 247.16.14.9.59648 > 202.138.*.*.161:  C="public" GetRequest(95)  .1.3.6.1.2.1.1.5.0 .1.3.6.1.2.1.2.2.1.2.84 .1.3.6.1.2.1.31.1.1.1.1.84 .1.3.6.1.2.1.31.1.1.1.18.84 .1.3.6.1.2.1.31.1.1.1.15.84
11:55:59.858098 IP 247.16.14.9.38338 > 202.138.*.*.161:  C="public" GetRequest(95)  .1.3.6.1.2.1.1.5.0 .1.3.6.1.2.1.2.2.1.2.54 .1.3.6.1.2.1.31.1.1.1.1.54 .1.3.6.1.2.1.31.1.1.1.18.54 .1.3.6.1.2.1.31.1.1.1.15.54
3 packets captured
```

```
vm-avocado:~# snmpwalk -v2c -c punlic 202.138.*.* .1.3.6.1.2.1.1.5.0
iso.3.6.1.2.1.1.5.0 = STRING: "gw-core-*.*.net"
```

read this discussion [#2372](https://github.com/akvorado/akvorado/discussions/2372) the config is correct. so that the data is not successfully sent to the clickhouse db

```
m-avocado:~# curl -s http://127.0.0.1:8080/api/v0/outlet/metrics | grep -P 'akvorado_outlet_clickhouse_(errors|flow)'
# HELP akvorado_outlet_clickhouse_flow_per_batch Number of flow per batch sent to ClickHouse.
# TYPE akvorado_outlet_clickhouse_flow_per_batch summary
akvorado_outlet_clickhouse_flow_per_batch{quantile="0.5"} NaN
akvorado_outlet_clickhouse_flow_per_batch{quantile="0.9"} NaN
akvorado_outlet_clickhouse_flow_per_batch{quantile="0.99"} NaN
akvorado_outlet_clickhouse_flow_per_batch_sum 0
akvorado_outlet_clickhouse_flow_per_batch_count 0
```

Dear Sir @vincentbernat  I appreciate it when you can take the time to look at it or help me out.

**Comment by vincentbernat** [comment]
First upgrade your Docker to 29.5.1 and try again.

**Reply by alifgufron** [reply]
Hello Vincent,
thank you for the response

```
vm-avocado# docker --version
docker version
Docker version 29.5.1, build 2518b52
Client: Docker Engine - Community
 Version:           29.5.1
 API version:       1.54
 Go version:        go1.26.3
 Git commit:        2518b52
 Built:             Mon May 18 15:24:42 2026
 OS/Arch:           linux/amd64
 Context:           default

Server: Docker Engine - Community
 Engine:
  Version:          29.5.1
  API version:      1.54 (minimum version 1.40)
  Go version:       go1.26.3
  Git commit:       dd24a3a
  Built:            Mon May 18 15:24:42 2026
  OS/Arch:          linux/amd64
  Experimental:     false
 containerd:
  Version:          v2.2.4
  GitCommit:        193637f7ee8ae5f5aa5248f49e7baa3e6164966e
 runc:
  Version:          1.3.5
  GitCommit:        v1.3.5-0-g488fc13e
 docker-init:
  Version:          0.19.0
  GitCommit:        de40ad0
```

after upgrade docker SNMP it works but data not sent to clickhouse

```
vm-avocado:/home/admin/docker/akvorado# curl -s http://127.0.0.1:8080/api/v0/inlet/metrics | grep 'akvorado_inlet_flow_input_udp_packets'
# HELP akvorado_inlet_flow_input_udp_packets_total Packets received by the application.
# TYPE akvorado_inlet_flow_input_udp_packets_total counter
akvorado_inlet_flow_input_udp_packets_total{exporter="202.138.*.*",listener=":2055",worker="1"} 9821
akvorado_inlet_flow_input_udp_packets_total{exporter="202.138.*.*",listener=":2055",worker="1"} 1133

vm-avocado:/home/admin/docker/akvorado# curl -s http://127.0.0.1:8080/api/v0/inlet/metrics | grep 'akvorado_inlet_flow_input_udp_packets'
# HELP akvorado_inlet_flow_input_udp_packets_total Packets received by the application.
# TYPE akvorado_inlet_flow_input_udp_packets_total counter
akvorado_inlet_flow_input_udp_packets_total{exporter="202.138.*.*",listener=":2055",worker="1"} 10413
akvorado_inlet_flow_input_udp_packets_total{exporter="202.138.*.*",listener=":2055",worker="1"} 1217

root@vm-avocado:/home/admin/docker/akvorado# nsenter -t $(pgrep -fo "akvorado outlet") -n tcpdump -c3 -pni eth0 port 161
tcpdump: verbose output suppressed, use -v[v]... for full protocol decode
listening on eth0, link-type EN10MB (Ethernet), snapshot length 262144 bytes
16:55:46.777974 IP 247.16.14.10.38345 > 202.138.*.*.161:  C="public" GetRequest(95)  .1.3.6.1.2.1.1.5.0 .1.3.6.1.2.1.2.2.1.2.42 .1.3.6.1.2.1.31.1.1.1.1.42 .1.3.6.1.2.1.31.1.1.1.18.42 .1.3.6.1.2.1.31.1.1.1.15.42
16:55:46.778911 IP 202.138.*.*.161 > 247.16.14.10.38345:  C="public" GetResponse(148)  .1.3.6.1.2.1.1.5.0="gw-core-*.*.net" .1.3.6.1.2.1.2.2.1.2.42="Port-channel1.601" .1.3.6.1.2.1.31.1.1.1.1.42="Po1.601" .1.3.6.1.2.1.31.1.1.1.18.42="JAB*" .1.3.6.1.2.1.31.1.1.1.15.42=40000
```

```
vm-avocado:~# curl -s http://127.0.0.1:8080/api/v0/outlet/metrics | grep -P 'akvorado_outlet_clickhouse_(errors|flow)'
# HELP akvorado_outlet_clickhouse_flow_per_batch Number of flow per batch sent to ClickHouse.
# TYPE akvorado_outlet_clickhouse_flow_per_batch summary
akvorado_outlet_clickhouse_flow_per_batch{quantile="0.5"} NaN
akvorado_outlet_clickhouse_flow_per_batch{quantile="0.9"} NaN
akvorado_outlet_clickhouse_flow_per_batch{quantile="0.99"} NaN
akvorado_outlet_clickhouse_flow_per_batch_sum 0
akvorado_outlet_clickhouse_flow_per_batch_count 0
```

```
vm-avocado:/home/admin/docker/akvorado# docker compose exec clickhouse clickhouse-client
ClickHouse client version 26.3.12.3 (official build).
Connecting to localhost:9000 as user default.
Connected to ClickHouse server version 26.3.12.

Warnings:
 * Linux is not using a fast clock source. Performance can be degraded. Check /sys/devices/system/clocksource/clocksource0/current_clocksource
 * Linux transparent hugepages are set to "always". Check /sys/kernel/mm/transparent_hugepage/enabled
 * Delay accounting is not enabled, OSIOWaitMicroseconds will not be gathered. You can enable it using `sudo sh -c 'echo 1 > /proc/sys/kernel/task_delayacct'` or by using sysctl.

6168c4880368 :) SHOW TABLES

SHOW TABLES

Query id: ff8e8dd7-9a51-4431-8f49-d4e1a3e01627

    ┌─name────────────────────────────────────────────┐
 1. │ asns                                            │
 2. │ exporters                                       │
 3. │ exporters_consumer                              │
 4. │ flows                                           │
 5. │ flows_1h0m0s                                    │
 6. │ flows_1h0m0s_consumer                           │
 7. │ flows_1m0s                                      │
 8. │ flows_1m0s_consumer                             │
 9. │ flows_5m0s                                      │
10. │ flows_5m0s_consumer                             │
11. │ flows_UWQDOVY5KYQ3JTOWJLWUD3UDWMv5_raw          │
12. │ flows_UWQDOVY5KYQ3JTOWJLWUD3UDWMv5_raw_consumer │
13. │ icmp                                            │
14. │ networks                                        │
15. │ protocols                                       │
16. │ tcp                                             │
17. │ udp                                             │
    └─────────────────────────────────────────────────┘

17 rows in set. Elapsed: 0.009 sec.

6168c4880368 :) SELECT name, element_count FROM system.dictionaries

SELECT
    name,
    element_count
FROM system.dictionaries

Query id: 3f3e0c31-861d-4274-8a87-cd53425a82d2

   ┌─name──────┬─element_count─┐
1. │ udp       │             0 │
2. │ icmp      │             0 │
3. │ networks  │       3762761 │ -- 3.76 million
4. │ protocols │             0 │
5. │ tcp       │             0 │
6. │ asns      │             0 │
   └───────────┴───────────────┘

6 rows in set. Elapsed: 0.010 sec.

6168c4880368 :) SELECT (now()-max(TimeReceived))/60
FROM flows

SELECT (now() - max(TimeReceived)) / 60
FROM flows

Query id: fa6bdf64-6b10-4714-9501-2189b3116a0c

   ┌─divide(minus⋯ived)), 60)─┐
1. │       29681887.316666666 │ -- 29.68 million
   └──────────────────────────┘

1 row in set. Elapsed: 0.024 sec.

6168c4880368 :) SELECT last_error_time, last_error_message
FROM system.errors
ORDER BY last_error_time LIMIT 10
FORMAT Vertical

SELECT
    last_error_time,
    last_error_message
FROM system.errors
ORDER BY last_error_time ASC
LIMIT 10
FORMAT Vertical

Query id: 9dbacac7-dfb5-4747-a2e0-36f16085a3b8

Row 1:
──────
last_error_time:    2026-06-08 09:56:19
last_error_message: I/O error: Broken pipe, while writing to socket ([::ffff:247.16.14.4]:9000 -> [::ffff:247.16.14.11]:55202)

1 row in set. Elapsed: 0.008 sec.

6168c4880368 :) select * from exporters;

SELECT *
FROM exporters

Query id: 3ca005aa-ce8d-49cf-9993-5f910e224755

Ok.

0 rows in set. Elapsed: 0.007 sec.

```

**Reply by vincentbernat** [reply]
Can you execute the troubleshooting steps for the outlet? You do a few of them, but not all.

**Reply by alifgufron** [reply]
Hello Vincent,

I have done the troubleshooting steps according to the documentation but I am confused that this happened after I upgraded the Akvorado version. 

I use 2 router exporters and I tried one by one both Cisco ASR and RouterOS, the results were the same, it doesn't appear in the UI and the data is saved in Clickhouse.

```
curl -s http://127.0.0.1:8080/api/v0/outlet/flows\?limit\=1
```

Nothing appears after waiting for quite some time

But the metrics keep increasing

```
vm-avocadoo:/home/admin/docker/akvorado# curl -s http://127.0.0.1:8080/api/v0/outlet/metrics | grep 'akvorado_outlet_kafka_received_messages'
# HELP akvorado_outlet_kafka_received_messages_total Number of messages received for a given worker.
# TYPE akvorado_outlet_kafka_received_messages_total counter
akvorado_outlet_kafka_received_messages_total{worker="0"} 1.94099225e+08

vm-avocado:/home/admin/docker/akvorado# curl -s http://127.0.0.1:8080/api/v0/outlet/metrics | grep 'akvorado_outlet_kafka_received_messages'
# HELP akvorado_outlet_kafka_received_messages_total Number of messages received for a given worker.
# TYPE akvorado_outlet_kafka_received_messages_total counter
akvorado_outlet_kafka_received_messages_total{worker="0"} 1.94100408e+08

vm-avocado:/home/admin/docker/akvorado# curl -s http://127.0.0.1:8080/api/v0/outlet/metrics | grep 'akvorado_outlet_kafka_received_messages'
# HELP akvorado_outlet_kafka_received_messages_total Number of messages received for a given worker.
# TYPE akvorado_outlet_kafka_received_messages_total counter
akvorado_outlet_kafka_received_messages_total{worker="0"} 1.94102373e+08
```

```
vm-avocado:/home/admin/docker/akvorado# curl -s http://127.0.0.1:8080/api/v0/outlet/metrics | grep -P 'akvorado_outlet_core_(received|forwarded)'
# HELP akvorado_outlet_core_received_flows_total Number of incoming flows.
# TYPE akvorado_outlet_core_received_flows_total counter
akvorado_outlet_core_received_flows_total{exporter="202.138.*.*"} 4.413667293e+09
akvorado_outlet_core_received_flows_total{exporter="202.138.*"} 4.00897851e+08
# HELP akvorado_outlet_core_received_raw_flows_total Number of incoming raw flows (proto).
# TYPE akvorado_outlet_core_received_raw_flows_total counter
akvorado_outlet_core_received_raw_flows_total 1.941423*e+08

vm-avocado:/home/admin/docker/akvorado# curl -s http://127.0.0.1:8080/api/v0/outlet/metrics | grep -P 'akvorado_outlet_core_(received|forwarded)'
# HELP akvorado_outlet_core_received_flows_total Number of incoming flows.
# TYPE akvorado_outlet_core_received_flows_total counter
akvorado_outlet_core_received_flows_total{exporter="202.138.*.*"} 4.413732607e+09
akvorado_outlet_core_received_flows_total{exporter="202.138.*.*"} 4.00901648e+08
# HELP akvorado_outlet_core_received_raw_flows_total Number of incoming raw flows (proto).
# TYPE akvorado_outlet_core_received_raw_flows_total counter
akvorado_outlet_core_received_raw_flows_total 1.94145042e+08

vm-avocado:/home/admin/docker/akvorado# curl -s http://127.0.0.1:8080/api/v0/outlet/metrics | grep -P 'akvorado_outlet_core_(received|forwarded)'
# HELP akvorado_outlet_core_received_flows_total Number of incoming flows.
# TYPE akvorado_outlet_core_received_flows_total counter
akvorado_outlet_core_received_flows_total{exporter="202.138.*.*"} 4.413782157e+09
akvorado_outlet_core_received_flows_total{exporter="202.138.*.*"} 4.00903952e+08
# HELP akvorado_outlet_core_received_raw_flows_total Number of incoming raw flows (proto).
# TYPE akvorado_outlet_core_received_raw_flows_total counter
akvorado_outlet_core_received_raw_flows_total 1.94147048e+08
```

Error

```
vm-avocado:/home/admin/docker/akvorado# curl -s http://127.0.0.1:8080/api/v0/outlet/metrics | grep 'akvorado_outlet_flow.*errors'

vm-avocado:/home/admin/docker/akvorado# curl -s http://127.0.0.1:8080/api/v0/outlet/metrics | grep 'akvorado_outlet_core.*errors'
# HELP akvorado_outlet_core_flows_errors_total Number of flows with errors.
# TYPE akvorado_outlet_core_flows_errors_total counter
akvorado_outlet_core_flows_errors_total{error="sampling rate missing",exporter="202.138.*.*"} 4.414878308e+09
akvorado_outlet_core_flows_errors_total{error="sampling rate missing",exporter="202.138.*.*"} 4.00955832e+08

vm-avocado:/home/admin/docker/akvorado# curl -s http://127.0.0.1:8080/api/v0/outlet/metrics | grep 'akvorado_outlet_core.*errors'
# HELP akvorado_outlet_core_flows_errors_total Number of flows with errors.
# TYPE akvorado_outlet_core_flows_errors_total counter
akvorado_outlet_core_flows_errors_total{error="sampling rate missing",exporter="202.138.*.*"} 4.414940125e+09
akvorado_outlet_core_flows_errors_total{error="sampling rate missing",exporter="202.138.*.*"} 4.00958692e+08
```

tcpdump

```
vm-avocado:/home/alif# nsenter -t $(pgrep -fo "akvorado outlet") -n tcpdump -c3 -pni eth0 port 161
tcpdump: verbose output suppressed, use -v[v]... for full protocol decode
listening on eth0, link-type EN10MB (Ethernet), snapshot length 262144 bytes
15:44:03.307356 IP 247.16.14.10.48150 > 202.138.*.*.161:  C="public" GetRequest(107)  .1.3.6.1.2.1.1.5.0 .1.3.6.1.2.1.2.2.1.2.15732665 .1.3.6.1.2.1.31.1.1.1.1.15732665 .1.3.6.1.2.1.31.1.1.1.18.15732665 .1.3.6.1.2.1.31.1.1.1.15.15732665
15:44:03.330213 IP 202.138.*.*.161 > 247.16.14.10.48150:  C="public" GetResponse(149)  .1.3.6.1.2.1.1.5.0="GW1" .1.3.6.1.2.1.2.2.1.2.15732665="***" .1.3.6.1.2.1.31.1.1.1.1.15732665="***" .1.3.6.1.2.1.31.1.1.1.18.15732665="" .1.3.6.1.2.1.31.1.1.1.15.15732665=0
3 packets captured
4 packets received by filter
0 packets dropped by kernel
```

**Reply by vincentbernat** [reply]
So, it looks like the sampling rate is not present in the flow. Did you configure a static one? Which version of RouterOS are you using?

**Reply by alifgufron** [reply]
Hello Vincent, im use Router OS V7 and Cisco ASR 1000, on the RouterOS im not configure packet sampling but on Cisco Router ASR im use default-sampling-rate 100, I tried running the flow one by one from both Cisco and RouterOS, but they all didn't work.

**Reply by vincentbernat** [reply]
For the ASR, do you have `option sampler-table timeout 10` in your configuration?

**Reply by alifgufron** [reply]
This ASR Config
```
flow exporter FLOW-EXPORTER-AKVORADO
 destination 202.138.*.* vrf monitoring
 source Loopback0
 transport udp 2055
 option sampler-table timeout 10
 ```
 
 ```
 flow record FLOW-RECORD-AKVORADO
 match ipv4 tos
 match ipv4 protocol
 match ipv4 source address
 match ipv4 destination address
 match transport source-port
 match transport destination-port
 collect routing source as 4-octet
 collect routing destination as 4-octet
 collect routing next-hop address ipv4
 collect transport tcp flags
 collect interface output
 collect interface input
 collect counter bytes
 collect counter packets
 collect timestamp sys-uptime first
 collect timestamp sys-uptime last

sampler SAMPLER-RANDOM
 mode random 1 out-of 100

flow exporter FLOW-EXPORTER-AKVORADO
 destination 202.138.*.* vrf monitoring
 source Loopback0
 transport udp 2055
 option sampler-table timeout 10

flow monitor FLOW-MONITOR-IIX
 exporter FLOW-EXPORTER-AKVORADO
 cache timeout inactive 10
 cache timeout active 60
 record FLOW-RECORD-AKVORADO

interface Port-channel1.600
 description IIX
 encapsulation dot1Q 600
 ip address 123.108.12.47 255.255.248.0
 no ip redirects
 no ip unreachables
 no ip proxy-arp
 ip flow monitor FLOW-MONITOR-IIX sampler SAMPLER-RANDOM input
 ip flow monitor FLOW-MONITOR-IIX sampler SAMPLER-RANDOM output
 no keepalive
 ```

**Comment by vincentbernat** [comment]
Is `akvorado_outlet_core_flows_errors_total{error="sampling rate missing",exporter="202.138.*.*"}` still increasing? Can you show all the metrics for `202.138.*.*` (the ASR ones)?

**Comment by alifgufron** [comment]
Thank you for your quick response.

Okay, now I'm trying to run the flow only from ASR and I'm recreating my docker.

In the config/akvorado.yaml file I only changed `asns` and `networks` & in the fille config/inlet.yaml i only changed `comunities`

on `.env` disable demo and use GeoIP provider `IPinfo` and The outlet metrics values ​​continue to increase. Inlet outlet SNMP is successful but why is it not saved to the database?

Here are the troubleshooting results

## ASR Config

```
flow record FLOW-RECORD-AKVORADO
 match ipv4 tos
 match ipv4 protocol
 match ipv4 source address
 match ipv4 destination address
 match transport source-port
 match transport destination-port
 collect routing source as 4-octet
 collect routing destination as 4-octet
 collect routing next-hop address ipv4
 collect transport tcp flags
 collect interface output
 collect interface input
 collect counter bytes
 collect counter packets
 collect timestamp sys-uptime first
 collect timestamp sys-uptime last

sampler SAMPLER-RANDOM
 mode random 1 out-of 100

flow exporter FLOW-EXPORTER-AKVORADO
 destination 202.138.*.* vrf monitoring
 source Loopback0
 transport udp 2055
 option sampler-table timeout 10

flow monitor FLOW-MONITOR-IIX
 exporter FLOW-EXPORTER-AKVORADO
 cache timeout inactive 10
 cache timeout active 60
 record FLOW-RECORD-AKVORADO

interface Port-channel1.600
 description IIX
 encapsulation dot1Q 600
 ip address 123.108.12.47 255.255.248.0
 no ip redirects
 no ip unreachables
 no ip proxy-arp
 ip flow monitor FLOW-MONITOR-IIX sampler SAMPLER-RANDOM input
 ip flow monitor FLOW-MONITOR-IIX sampler SAMPLER-RANDOM output
 no keepalive
```

## TCP Dump

```
# tcpdump -c5 -pni enp0s5 port 2055
tcpdump: verbose output suppressed, use -v[v]... for full protocol decode
listening on enp0s5, link-type EN10MB (Ethernet), snapshot length 262144 bytes
11:31:21.300246 IP 202.138.*.*64356 > 202.138.*.*.2055: UDP, length 76
11:31:21.336277 IP 202.138.*.*.64356 > 202.138.*.*.2055: UDP, length 1452
11:31:21.336290 IP 202.138.*.*.64356 > 202.138.*.*.2055: UDP, length 1452
11:31:21.336377 IP 202.138.*.*.64356 > 202.138.*.*.2055: UDP, length 1300
11:31:21.338188 IP 202.138.*.*.64356 > 202.138.*.*.2055: UDP, length 1452
5 packets captured
92 packets received by filter
0 packets dropped by kernel
```

## Run `Contrack` before Run `Docker Compose`

```
# conntrack -D -p udp --orig-port-dst 2055
udp      17 29 src=202.138.*.* dst=202.138.*.* sport=64356 dport=2055 [UNREPLIED] src=202.138.*.* dst=202.138.*.* sport=2055 dport=64356 mark=0 use=1
conntrack v1.4.7 (conntrack-tools): 1 flow entries have been deleted.
```

## Docker Container
```
# docker ps -a
CONTAINER ID   IMAGE                                        COMMAND                  CREATED          STATUS                    PORTS                                                                                                                                             NAMES
2571dcb135fd   quay.io/akvorado/akvorado:2.4.0              "/usr/local/bin/akvo…"   11 minutes ago   Up 10 minutes (healthy)   8080/tcp, 0.0.0.0:10179->10179/tcp, [::]:10179->10179/tcp                                                                                         akvorado-akvorado-outlet-1
ab899ab1faa5   quay.io/akvorado/akvorado:2.4.0              "/usr/local/bin/akvo…"   11 minutes ago   Up 10 minutes (healthy)   8080/tcp                                                                                                                                          akvorado-akvorado-console-1
02cd273ce611   quay.io/akvorado/akvorado:2.4.0              "/usr/local/bin/akvo…"   11 minutes ago   Up 10 minutes (healthy)   0.0.0.0:2055->2055/udp, [::]:2055->2055/udp, 0.0.0.0:4739->4739/udp, [::]:4739->4739/udp, 0.0.0.0:6343->6343/udp, [::]:6343->6343/udp, 8080/tcp   akvorado-akvorado-inlet-1
c12fb59d7624   kafbat/kafka-ui:v1.5.0                       "/bin/sh -c 'java --…"   11 minutes ago   Up 11 minutes             8080/tcp                                                                                                                                          akvorado-kafka-ui-1
e4617b3f6093   quay.io/akvorado/akvorado:2.4.0              "/usr/local/bin/akvo…"   11 minutes ago   Up 10 minutes (healthy)   8080/tcp                                                                                                                                          akvorado-akvorado-orchestrator-1
f4429a6c4489   traefik:v3.7                                 "/entrypoint.sh trae…"   11 minutes ago   Up 11 minutes             80/tcp, 127.0.0.1:8080->8080/tcp, 0.0.0.0:8081->8081/tcp, [::]:8081->8081/tcp                                                                     akvorado-traefik-1
8c2962db001a   clickhouse/clickhouse-server:26.3            "/entrypoint.sh"         11 minutes ago   Up 11 minutes (healthy)   8123/tcp, 9000/tcp, 9009/tcp                                                                                                                      akvorado-clickhouse-1
7e145c3c6e6a   valkey/valkey:9.0                            "docker-entrypoint.s…"   11 minutes ago   Up 11 minutes (healthy)   6379/tcp                                                                                                                                          akvorado-redis-1
6c7f5db02160   apache/kafka:4.2.0                           "/__cacert_entrypoin…"   11 minutes ago   Up 11 minutes (healthy)   9092/tcp                                                                                                                                          akvorado-kafka-1
24e55fcd40dc   quay.io/akvorado/ipinfo-geoipupdate:latest   "/usr/local/bin/ipin…"   11 minutes ago   Up 11 minutes (healthy)                                                                                                                                                     akvorado-geoip-1
```

## Troubleshooting

### Basic checks
```
# docker system df
TYPE            TOTAL     ACTIVE    SIZE      RECLAIMABLE
Images          7         7         2.136GB   0B (0%)
Containers      10        10        15.56MB   0B (0%)
Local Volumes   30        7         1.566GB   539.5kB (0%)
Build Cache     0         0         0B        0B
```

```
# docker compose ps --format "table {{.Service}}\t{{.Status}}"
SERVICE                 STATUS
akvorado-console        Up 11 minutes (healthy)
akvorado-inlet          Up 11 minutes (healthy)
akvorado-orchestrator   Up 11 minutes (healthy)
akvorado-outlet         Up 11 minutes (healthy)
clickhouse              Up 12 minutes (healthy)
geoip                   Up 12 minutes (healthy)
kafka                   Up 12 minutes (healthy)
kafka-ui                Up 12 minutes
redis                   Up 12 minutes (healthy)
traefik                 Up 12 minutes
```

### Akvorado Inlet Logs

```
# docker compose logs akvorado-inlet
akvorado-inlet-1  | {"level":"info","listen":":8080","time":"2026-06-22T04:33:55Z","caller":"akvorado/common/httpserver/root.go:164","module":"akvorado/common/httpserver","message":"starting HTTP server"}
akvorado-inlet-1  | {"level":"info","listen":"@akvorado","time":"2026-06-22T04:33:55Z","caller":"akvorado/common/httpserver/root.go:164","module":"akvorado/common/httpserver","message":"starting HTTP server"}
akvorado-inlet-1  | {"level":"info","listen":"@akvorado/inlet","time":"2026-06-22T04:33:55Z","caller":"akvorado/common/httpserver/root.go:164","module":"akvorado/common/httpserver","message":"starting HTTP server"}
akvorado-inlet-1  | {"level":"info","time":"2026-06-22T04:33:55Z","caller":"akvorado/inlet/kafka/root.go:80","module":"akvorado/inlet/kafka","message":"starting Kafka component"}
akvorado-inlet-1  | {"level":"info","listen":":2055","time":"2026-06-22T04:33:55Z","caller":"akvorado/inlet/flow/input/udp/root.go:115","module":"akvorado/inlet/flow/input/udp","message":"starting UDP input"}
akvorado-inlet-1  | {"level":"info","listen":"[::]:2055","time":"2026-06-22T04:33:55Z","caller":"akvorado/inlet/flow/input/udp/root.go:141","module":"akvorado/inlet/flow/input/udp","message":"UDP input listening"}
akvorado-inlet-1  | {"level":"warn","error":"can't assign eBPF programs: operation not permitted (BPF capability missing or MEMLOCK too low)","time":"2026-06-22T04:33:55Z","caller":"akvorado/inlet/flow/input/udp/root.go:181","module":"akvorado/inlet/flow/input/udp","message":"cannot attach eBPF program for SO_REUSEPORT"}
akvorado-inlet-1  | {"level":"info","listen":":4739","time":"2026-06-22T04:33:55Z","caller":"akvorado/inlet/flow/input/udp/root.go:115","module":"akvorado/inlet/flow/input/udp","message":"starting UDP input"}
akvorado-inlet-1  | {"level":"info","listen":"[::]:4739","time":"2026-06-22T04:33:55Z","caller":"akvorado/inlet/flow/input/udp/root.go:141","module":"akvorado/inlet/flow/input/udp","message":"UDP input listening"}
akvorado-inlet-1  | {"level":"warn","error":"can't assign eBPF programs: operation not permitted (BPF capability missing or MEMLOCK too low)","time":"2026-06-22T04:33:55Z","caller":"akvorado/inlet/flow/input/udp/root.go:181","module":"akvorado/inlet/flow/input/udp","message":"cannot attach eBPF program for SO_REUSEPORT"}
akvorado-inlet-1  | {"level":"info","listen":":6343","time":"2026-06-22T04:33:55Z","caller":"akvorado/inlet/flow/input/udp/root.go:115","module":"akvorado/inlet/flow/input/udp","message":"starting UDP input"}
akvorado-inlet-1  | {"level":"info","listen":"[::]:6343","time":"2026-06-22T04:33:55Z","caller":"akvorado/inlet/flow/input/udp/root.go:141","module":"akvorado/inlet/flow/input/udp","message":"UDP input listening"}
akvorado-inlet-1  | {"level":"warn","error":"can't assign eBPF programs: operation not permitted (BPF capability missing or MEMLOCK too low)","time":"2026-06-22T04:33:55Z","caller":"akvorado/inlet/flow/input/udp/root.go:181","module":"akvorado/inlet/flow/input/udp","message":"cannot attach eBPF program for SO_REUSEPORT"}
akvorado-inlet-1  | {"level":"info","version":"v2.4.0","time":"2026-06-22T04:33:55Z","message":"akvorado has started"}
akvorado-inlet-1  | {"level":"info","why":"forced load because we are producing to a topic for the first time","time":"2026-06-22T04:33:55Z","caller":"akvorado/common/kafka/logs.go:42","module":"akvorado/common/kafka","message":"immediate metadata update triggered"}
akvorado-inlet-1  | {"level":"info","topic":"flows-v5","time":"2026-06-22T04:33:55Z","caller":"akvorado/common/kafka/logs.go:42","module":"akvorado/common/kafka","message":"producing to a new topic for the first time, fetching metadata to learn its partitions"}
akvorado-inlet-1  | {"level":"info","topic":"flows-v5","time":"2026-06-22T04:33:55Z","caller":"akvorado/common/kafka/logs.go:42","module":"akvorado/common/kafka","message":"done waiting for metadata for new topic"}
akvorado-inlet-1  | {"level":"info","time":"2026-06-22T04:33:55Z","caller":"akvorado/common/kafka/logs.go:42","module":"akvorado/common/kafka","message":"initializing producer id"}
akvorado-inlet-1  | {"level":"info","id":0,"epoch":0,"time":"2026-06-22T04:33:56Z","caller":"akvorado/common/kafka/logs.go:42","module":"akvorado/common/kafka","message":"producer id initialization success"}
```

### Inlet Metrics

```
# curl -s http://127.0.0.1:8080/api/v0/inlet/metrics
# HELP akvorado_cmd_dropped_log_messages Number of log messages dropped.
# TYPE akvorado_cmd_dropped_log_messages gauge
akvorado_cmd_dropped_log_messages 0
# HELP akvorado_cmd_info Akvorado build information.
# TYPE akvorado_cmd_info gauge
akvorado_cmd_info{compiler="go1.26.3",version="v2.4.0"} 1
# HELP akvorado_cmd_uptime_seconds Number of seconds the application is running.
# TYPE akvorado_cmd_uptime_seconds gauge
akvorado_cmd_uptime_seconds 919.075931953
# HELP akvorado_common_httpserver_inflight_requests Number of requests currently being served by the HTTP server.
# TYPE akvorado_common_httpserver_inflight_requests gauge
akvorado_common_httpserver_inflight_requests 1
# HELP akvorado_common_httpserver_request_duration_seconds Latencies for served requests.
# TYPE akvorado_common_httpserver_request_duration_seconds histogram
akvorado_common_httpserver_request_duration_seconds_bucket{handler="/api/",method="get",le="0.25"} 45
akvorado_common_httpserver_request_duration_seconds_bucket{handler="/api/",method="get",le="0.5"} 45
akvorado_common_httpserver_request_duration_seconds_bucket{handler="/api/",method="get",le="1"} 45
akvorado_common_httpserver_request_duration_seconds_bucket{handler="/api/",method="get",le="2.5"} 45
akvorado_common_httpserver_request_duration_seconds_bucket{handler="/api/",method="get",le="5"} 45
akvorado_common_httpserver_request_duration_seconds_bucket{handler="/api/",method="get",le="10"} 45
akvorado_common_httpserver_request_duration_seconds_bucket{handler="/api/",method="get",le="+Inf"} 45
akvorado_common_httpserver_request_duration_seconds_sum{handler="/api/",method="get"} 0.016252837000000006
akvorado_common_httpserver_request_duration_seconds_count{handler="/api/",method="get"} 45
# HELP akvorado_common_httpserver_requests_total Number of requests handled by an handler.
# TYPE akvorado_common_httpserver_requests_total counter
akvorado_common_httpserver_requests_total{code="200",handler="/api/",method="get"} 45
# HELP akvorado_common_httpserver_response_size_bytes Response sizes for requests.
# TYPE akvorado_common_httpserver_response_size_bytes histogram
akvorado_common_httpserver_response_size_bytes_bucket{handler="/api/",method="get",le="200"} 45
akvorado_common_httpserver_response_size_bytes_bucket{handler="/api/",method="get",le="500"} 45
akvorado_common_httpserver_response_size_bytes_bucket{handler="/api/",method="get",le="1000"} 45
akvorado_common_httpserver_response_size_bytes_bucket{handler="/api/",method="get",le="1500"} 45
akvorado_common_httpserver_response_size_bytes_bucket{handler="/api/",method="get",le="5000"} 45
akvorado_common_httpserver_response_size_bytes_bucket{handler="/api/",method="get",le="+Inf"} 45
akvorado_common_httpserver_response_size_bytes_sum{handler="/api/",method="get"} 720
akvorado_common_httpserver_response_size_bytes_count{handler="/api/",method="get"} 45
# HELP akvorado_inlet_flow_input_udp_buffer_size_bytes Size of the in-kernel buffer for this worker.
# TYPE akvorado_inlet_flow_input_udp_buffer_size_bytes gauge
akvorado_inlet_flow_input_udp_buffer_size_bytes{listener=":2055",worker="0"} 425984
akvorado_inlet_flow_input_udp_buffer_size_bytes{listener=":2055",worker="1"} 425984
akvorado_inlet_flow_input_udp_buffer_size_bytes{listener=":2055",worker="2"} 425984
akvorado_inlet_flow_input_udp_buffer_size_bytes{listener=":2055",worker="3"} 425984
akvorado_inlet_flow_input_udp_buffer_size_bytes{listener=":4739",worker="0"} 425984
akvorado_inlet_flow_input_udp_buffer_size_bytes{listener=":4739",worker="1"} 425984
akvorado_inlet_flow_input_udp_buffer_size_bytes{listener=":4739",worker="2"} 425984
akvorado_inlet_flow_input_udp_buffer_size_bytes{listener=":4739",worker="3"} 425984
akvorado_inlet_flow_input_udp_buffer_size_bytes{listener=":6343",worker="0"} 425984
akvorado_inlet_flow_input_udp_buffer_size_bytes{listener=":6343",worker="1"} 425984
akvorado_inlet_flow_input_udp_buffer_size_bytes{listener=":6343",worker="2"} 425984
akvorado_inlet_flow_input_udp_buffer_size_bytes{listener=":6343",worker="3"} 425984
# HELP akvorado_inlet_flow_input_udp_bytes_total Bytes received by the application.
# TYPE akvorado_inlet_flow_input_udp_bytes_total counter
akvorado_inlet_flow_input_udp_bytes_total{exporter="202.138.*.*",listener=":2055",worker="0"} 4.8039298e+08
akvorado_inlet_flow_input_udp_bytes_total{exporter="202.138.*.*",listener=":2055",worker="1"} 92
# HELP akvorado_inlet_flow_input_udp_ebpf_loaded Is eBPF load balancer enabled?
# TYPE akvorado_inlet_flow_input_udp_ebpf_loaded gauge
akvorado_inlet_flow_input_udp_ebpf_loaded 0
# HELP akvorado_inlet_flow_input_udp_errors_total Errors while receiving packets by the application.
# TYPE akvorado_inlet_flow_input_udp_errors_total counter
akvorado_inlet_flow_input_udp_errors_total{listener=":2055",worker="0"} 0
akvorado_inlet_flow_input_udp_errors_total{listener=":2055",worker="1"} 0
akvorado_inlet_flow_input_udp_errors_total{listener=":2055",worker="2"} 0
akvorado_inlet_flow_input_udp_errors_total{listener=":2055",worker="3"} 0
akvorado_inlet_flow_input_udp_errors_total{listener=":4739",worker="0"} 0
akvorado_inlet_flow_input_udp_errors_total{listener=":4739",worker="1"} 0
akvorado_inlet_flow_input_udp_errors_total{listener=":4739",worker="2"} 0
akvorado_inlet_flow_input_udp_errors_total{listener=":4739",worker="3"} 0
akvorado_inlet_flow_input_udp_errors_total{listener=":6343",worker="0"} 0
akvorado_inlet_flow_input_udp_errors_total{listener=":6343",worker="1"} 0
akvorado_inlet_flow_input_udp_errors_total{listener=":6343",worker="2"} 0
akvorado_inlet_flow_input_udp_errors_total{listener=":6343",worker="3"} 0
# HELP akvorado_inlet_flow_input_udp_in_dropped_packets_total Dropped packets due to listen queue full.
# TYPE akvorado_inlet_flow_input_udp_in_dropped_packets_total gauge
akvorado_inlet_flow_input_udp_in_dropped_packets_total{listener=":2055",worker="0"} 0
akvorado_inlet_flow_input_udp_in_dropped_packets_total{listener=":2055",worker="1"} 0
akvorado_inlet_flow_input_udp_in_dropped_packets_total{listener=":2055",worker="2"} 0
akvorado_inlet_flow_input_udp_in_dropped_packets_total{listener=":2055",worker="3"} 0
akvorado_inlet_flow_input_udp_in_dropped_packets_total{listener=":4739",worker="0"} 0
akvorado_inlet_flow_input_udp_in_dropped_packets_total{listener=":4739",worker="1"} 0
akvorado_inlet_flow_input_udp_in_dropped_packets_total{listener=":4739",worker="2"} 0
akvorado_inlet_flow_input_udp_in_dropped_packets_total{listener=":4739",worker="3"} 0
akvorado_inlet_flow_input_udp_in_dropped_packets_total{listener=":6343",worker="0"} 0
akvorado_inlet_flow_input_udp_in_dropped_packets_total{listener=":6343",worker="1"} 0
akvorado_inlet_flow_input_udp_in_dropped_packets_total{listener=":6343",worker="2"} 0
akvorado_inlet_flow_input_udp_in_dropped_packets_total{listener=":6343",worker="3"} 0
# HELP akvorado_inlet_flow_input_udp_packets_total Packets received by the application.
# TYPE akvorado_inlet_flow_input_udp_packets_total counter
akvorado_inlet_flow_input_udp_packets_total{exporter="202.138.*.*",listener=":2055",worker="0"} 346359
akvorado_inlet_flow_input_udp_packets_total{exporter="202.138.255.17",listener=":2055",worker="1"} 1
# HELP akvorado_inlet_flow_input_udp_size_bytes Summary of packet size.
# TYPE akvorado_inlet_flow_input_udp_size_bytes summary
akvorado_inlet_flow_input_udp_size_bytes{exporter="202.138.*.*",listener=":2055",worker="0",quantile="0.5"} 1452
akvorado_inlet_flow_input_udp_size_bytes{exporter="202.138.*.*",listener=":2055",worker="0",quantile="0.9"} 1452
akvorado_inlet_flow_input_udp_size_bytes{exporter="202.138.*.*",listener=":2055",worker="0",quantile="0.99"} 1452
akvorado_inlet_flow_input_udp_size_bytes_sum{exporter="202.138.*.*",listener=":2055",worker="0"} 4.8039298e+08
akvorado_inlet_flow_input_udp_size_bytes_count{exporter="202.138.*.*",listener=":2055",worker="0"} 346359
akvorado_inlet_flow_input_udp_size_bytes{exporter="202.138.*.*",listener=":2055",worker="1",quantile="0.5"} 92
akvorado_inlet_flow_input_udp_size_bytes{exporter="202.138.*.*",listener=":2055",worker="1",quantile="0.9"} 92
akvorado_inlet_flow_input_udp_size_bytes{exporter="202.138.*.*",listener=":2055",worker="1",quantile="0.99"} 92
akvorado_inlet_flow_input_udp_size_bytes_sum{exporter="202.138.*.*",listener=":2055",worker="1"} 92
akvorado_inlet_flow_input_udp_size_bytes_count{exporter="202.138.*.*",listener=":2055",worker="1"} 1
```

### Error Metrics

```
# curl -s http://127.0.0.1:8080/api/v0/inlet/metrics | grep 'akvorado_.*_error'
# HELP akvorado_inlet_flow_input_udp_errors_total Errors while receiving packets by the application.
# TYPE akvorado_inlet_flow_input_udp_errors_total counter
akvorado_inlet_flow_input_udp_errors_total{listener=":2055",worker="0"} 0
akvorado_inlet_flow_input_udp_errors_total{listener=":2055",worker="1"} 0
akvorado_inlet_flow_input_udp_errors_total{listener=":2055",worker="2"} 0
akvorado_inlet_flow_input_udp_errors_total{listener=":2055",worker="3"} 0
akvorado_inlet_flow_input_udp_errors_total{listener=":4739",worker="0"} 0
akvorado_inlet_flow_input_udp_errors_total{listener=":4739",worker="1"} 0
akvorado_inlet_flow_input_udp_errors_total{listener=":4739",worker="2"} 0
akvorado_inlet_flow_input_udp_errors_total{listener=":4739",worker="3"} 0
akvorado_inlet_flow_input_udp_errors_total{listener=":6343",worker="0"} 0
akvorado_inlet_flow_input_udp_errors_total{listener=":6343",worker="1"} 0
akvorado_inlet_flow_input_udp_errors_total{listener=":6343",worker="2"} 0
akvorado_inlet_flow_input_udp_errors_total{listener=":6343",worker="3"} 0
```

### Inlet service

```
vm-avocado:# curl -s http://127.0.0.1:8080/api/v0/inlet/metrics | grep 'akvorado_inlet_flow_input_udp_packets'
# HELP akvorado_inlet_flow_input_udp_packets_total Packets received by the application.
# TYPE akvorado_inlet_flow_input_udp_packets_total counter
akvorado_inlet_flow_input_udp_packets_total{exporter="202.138.*.*",listener=":2055",worker="0"} 424994
akvorado_inlet_flow_input_udp_packets_total{exporter="202.138.*.*",listener=":2055",worker="1"} 2

vm-avocado:# curl -s http://127.0.0.1:8080/api/v0/inlet/metrics | grep 'akvorado_inlet_flow_input_udp_packets'
# HELP akvorado_inlet_flow_input_udp_packets_total Packets received by the application.
# TYPE akvorado_inlet_flow_input_udp_packets_total counter
akvorado_inlet_flow_input_udp_packets_total{exporter="202.138.*.*",listener=":2055",worker="0"} 452494
akvorado_inlet_flow_input_udp_packets_total{exporter="202.138.*.*",listener=":2055",worker="1"} 2

```

### Inlet Flow Kafka

```
vm-avocado:# curl -s http://127.0.0.1:8080/api/v0/inlet/metrics | grep 'akvorado_inlet_kafka_sent_messages'
# HELP akvorado_inlet_kafka_sent_messages_total Number of messages sent from a given exporter.
# TYPE akvorado_inlet_kafka_sent_messages_total counter
akvorado_inlet_kafka_sent_messages_total{exporter="202.138.*.*"} 580201
akvorado_inlet_kafka_sent_messages_total{exporter="202.138.*.*"} 2

vm-avocado:# curl -s http://127.0.0.1:8080/api/v0/inlet/metrics | grep 'akvorado_inlet_kafka_sent_messages'
# HELP akvorado_inlet_kafka_sent_messages_total Number of messages sent from a given exporter.
# TYPE akvorado_inlet_kafka_sent_messages_total counter
akvorado_inlet_kafka_sent_messages_total{exporter="202.138.*.*"} 595129
akvorado_inlet_kafka_sent_messages_total{exporter="202.138.*.*"} 2

```

### kafka everthing is ok and still increase


<img width="1188" height="1195" alt="kafka" src="https://github.com/user-attachments/assets/d3ae2817-a209-416b-8dd6-db39c9368b70" />

### Outlet
```
rvm-avocado:# curl -s http://127.0.0.1:8080/api/v0/outlet/metrics | grep 'akvorado_outlet_kafka_received_messages'
# HELP akvorado_outlet_kafka_received_messages_total Number of messages received for a given worker.
# TYPE akvorado_outlet_kafka_received_messages_total counter
akvorado_outlet_kafka_received_messages_total{worker="0"} 3.992277e+06

vm-avocado:# curl -s http://127.0.0.1:8080/api/v0/outlet/metrics | grep 'akvorado_outlet_kafka_received_messages'
# HELP akvorado_outlet_kafka_received_messages_total Number of messages received for a given worker.
# TYPE akvorado_outlet_kafka_received_messages_total counter
akvorado_outlet_kafka_received_messages_total{worker="0"} 3.995134e+06

vm-avocado:# curl -s http://127.0.0.1:8080/api/v0/outlet/metrics | grep 'akvorado_outlet_kafka_received_messages'
# HELP akvorado_outlet_kafka_received_messages_total Number of messages received for a given worker.
# TYPE akvorado_outlet_kafka_received_messages_total counter
akvorado_outlet_kafka_received_messages_total{worker="0"} 4.002402e+06

```

```
vm-avocado:# curl -s http://127.0.0.1:8080/api/v0/outlet/metrics | grep -P 'akvorado_outlet_core_(received|forwarded)'
# HELP akvorado_outlet_core_received_flows_total Number of incoming flows.
# TYPE akvorado_outlet_core_received_flows_total counter
akvorado_outlet_core_received_flows_total{exporter="202.138.*.*"} 1.08181886e+08
# HELP akvorado_outlet_core_received_raw_flows_total Number of incoming raw flows (proto).
# TYPE akvorado_outlet_core_received_raw_flows_total counter
akvorado_outlet_core_received_raw_flows_total 4.054153e+06

@vm-avocado:# curl -s http://127.0.0.1:8080/api/v0/outlet/metrics | grep -P 'akvorado_outlet_core_(received|forwarded)'
# HELP akvorado_outlet_core_received_flows_total Number of incoming flows.
# TYPE akvorado_outlet_core_received_flows_total counter
akvorado_outlet_core_received_flows_total{exporter="202.138.*.*"} 1.08233711e+08
# HELP akvorado_outlet_core_received_raw_flows_total Number of incoming raw flows (proto).
# TYPE akvorado_outlet_core_received_raw_flows_total counter
akvorado_outlet_core_received_raw_flows_total 4.05608e+06
```

### Error Pipeline
```
vm-avocado:# curl -s http://127.0.0.1:8080/api/v0/outlet/metrics | grep 'akvorado_outlet_flow.*errors'
vm-avocado:# curl -s http://127.0.0.1:8080/api/v0/outlet/metrics | grep 'akvorado_outlet_core.*errors'
# HELP akvorado_outlet_core_flows_errors_total Number of flows with errors.
# TYPE akvorado_outlet_core_flows_errors_total counter
akvorado_outlet_core_flows_errors_total{error="sampling rate missing",exporter="202.138.*.*7"} 1.0888695e+08

```

### SNMP Check 
```
vm-avocado:# nsenter -t $(pgrep -fo "akvorado outlet") -n tcpdump -c3 -pni eth0 port 161
tcpdump: verbose output suppressed, use -v[v]... for full protocol decode
listening on eth0, link-type EN10MB (Ethernet), snapshot length 262144 bytes
15:37:18.600425 IP 247.16.14.11.52919 > 202.138..*.*.161:  C="public" GetRequest(95)  .1.3.6.1.2.1.1.5.0 .1.3.6.1.2.1.2.2.1.2.58 .1.3.6.1.2.1.31.1.1.1.1.58 .1.3.6.1.2.1.31.1.1.1.18.58 .1.3.6.1.2.1.31.1.1.1.15.58
15:37:18.601254 IP 202.138.*.*.161 > 247.16.14.11.52919:  C="public" GetResponse(159)  .1.3.6.1.2.1.1.5.0="gw.*.net" .1.3.6.1.2.1.2.2.1.2.58="Port-channel2.50" .1.3.6.1.2.1.31.1.1.1.1.58="Po2.50" .1.3.6.1.2.1.31.1.1.1.18.58="MGMT-SWITCH" .1.3.6.1.2.1.31.1.1.1.15.58=40000
15:41:55.844813 IP 247.16.14.11.42014 > 202.138.*.*.161:  C="public" GetRequest(95)  .1.3.6.1.2.1.1.5.0 .1.3.6.1.2.1.2.2.1.2.56 .1.3.6.1.2.1.31.1.1.1.1.56 .1.3.6.1.2.1.31.1.1.1.18.56 .1.3.6.1.2.1.31.1.1.1.15.56
3 packets captured
68 packets received by filter
0 packets dropped by kernel

```

### Native SNMP

```
vm-avocado:# snmpwalk -v2c -c public 202.138.*.* iso.3.6.1.2.1.1.5.0
iso.3.6.1.2.1.1.5.0 = STRING: "gw.*.net"
```

### Check flow to ClickHouse

```
vm-avocado:# curl -s http://127.0.0.1:8080/api/v0/outlet/metrics | grep -P 'akvorado_outlet_clickhouse_(errors|flow)'
# HELP akvorado_outlet_clickhouse_flow_per_batch Number of flow per batch sent to ClickHouse.
# TYPE akvorado_outlet_clickhouse_flow_per_batch summary
akvorado_outlet_clickhouse_flow_per_batch{quantile="0.5"} NaN
akvorado_outlet_clickhouse_flow_per_batch{quantile="0.9"} NaN
akvorado_outlet_clickhouse_flow_per_batch{quantile="0.99"} NaN
akvorado_outlet_clickhouse_flow_per_batch_sum 0
akvorado_outlet_clickhouse_flow_per_batch_count 0
```
### Clickhouse Check
```
8c2962db001a :) SHOW TABLES

SHOW TABLES

Query id: cd56408f-6207-47b4-ad62-d9e30537b46a

    ┌─name────────────────────────────────────────────┐
 1. │ asns                                            │
 2. │ exporters                                       │
 3. │ exporters_consumer                              │
 4. │ flows                                           │
 5. │ flows_1h0m0s                                    │
 6. │ flows_1h0m0s_consumer                           │
 7. │ flows_1m0s                                      │
 8. │ flows_1m0s_consumer                             │
 9. │ flows_5m0s                                      │
10. │ flows_5m0s_consumer                             │
11. │ flows_UWQDOVY5KYQ3JTOWJLWUD3UDWMv5_raw          │
12. │ flows_UWQDOVY5KYQ3JTOWJLWUD3UDWMv5_raw_consumer │
13. │ icmp                                            │
14. │ networks                                        │
15. │ protocols                                       │
16. │ tcp                                             │
17. │ udp                                             │
    └─────────────────────────────────────────────────┘

17 rows in set. Elapsed: 0.009 sec.

8c2962db001a :) SELECT name, element_count FROM system.dictionaries

SELECT
    name,
    element_count
FROM system.dictionaries

Query id: 41d394f2-980a-457f-b188-1e440b070f67

   ┌─name──────┬─element_count─┐
1. │ tcp       │             0 │
2. │ networks  │       3477122 │ -- 3.48 million
3. │ udp       │             0 │
4. │ icmp      │             0 │
5. │ protocols │             0 │
6. │ asns      │             0 │
   └───────────┴───────────────┘

6 rows in set. Elapsed: 0.015 sec.

8c2962db001a :) SELECT (now()-max(TimeReceived))/60
FROM flows

SELECT (now() - max(TimeReceived)) / 60
FROM flows

Query id: 2ac55819-d02d-4263-910d-f906408027ba

   ┌─divide(minus⋯ived)), 60)─┐
1. │       29701974.666666668 │ -- 29.70 million
   └──────────────────────────┘

1 row in set. Elapsed: 0.023 sec.

8c2962db001a :) SELECT last_error_time, last_error_message
FROM system.errors
ORDER BY last_error_time LIMIT 10
FORMAT Vertical

SELECT
    last_error_time,
    last_error_message
FROM system.errors
ORDER BY last_error_time ASC
LIMIT 10
FORMAT Vertical

Query id: 091613b5-7f28-49d3-89d3-47b5d3eb8efa

Ok.

0 rows in set. Elapsed: 0.008 sec.
```

**Reply by vincentbernat** [reply]
You still have issues with sampling rate. Can you provide a PCAP capture of your flows (by email if you prefer)? 20-second capture should be OK.

BTW, you didn't obscure the IP addresses in this report, while you did previously.

**Reply by alifgufron** [reply]
Sure, I'll email the PCAP file to `vincent@bernat.ch`

Sorry about that, I've edited and redacted it.

Thank you for your help and troubleshooting.

**Reply by vincentbernat** [reply]
About redacting IP, it's up to you, I don't mind either way.

I had a look at your pcap and there are two flowsets without a template. Maybe you need to add:

```
template data timeout 60
template options timeout 60
```

I don't know the default value, but this way, you are sure that you get the templates in a 1-minute data capture.

**Reply by alifgufron** [reply]
Hello Vincent, I’ve adjusted the configuration on the ASR, but the issue persists: data isn't being saved to ClickHouse, even though the inlet and outlet process counts keep increasing.

```
flow record FLOW-RECORD-AKVORADO
 match ipv4 tos
 match ipv4 protocol
 match ipv4 source address
 match ipv4 destination address
 match transport source-port
 match transport destination-port
 collect routing source as 4-octet
 collect routing destination as 4-octet
 collect routing next-hop address ipv4
 collect transport tcp flags
 collect interface output
 collect interface input
 collect counter bytes
 collect counter packets
 collect timestamp sys-uptime first
 collect timestamp sys-uptime last

flow exporter FLOW-EXPORTER-AKVORADO
 destination 202.138.*.* vrf monitoring
 source Loopback0
 transport udp 2055
 template data timeout 60
 option interface-table timeout 60
 option vrf-table timeout 60
 option sampler-table timeout 60
 option application-table timeout 60

flow monitor FLOW-MONITOR-IIX
 exporter FLOW-EXPORTER-AKVORADO
 cache timeout inactive 10
 cache timeout active 60
 record FLOW-RECORD-AKVORADO

sampler SAMPLER-RANDOM
 mode random 1 out-of 100

interface Port-channel1.*
 description XXX
 encapsulation dot1Q *
 ip address * 255.255.248.0
 no ip redirects
 no ip unreachables
 no ip proxy-arp
 ip flow monitor FLOW-MONITOR-IIX sampler SAMPLER-RANDOM input
 ip flow monitor FLOW-MONITOR-IIX sampler SAMPLER-RANDOM output
 no keepalive
```

**Reply by vincentbernat** [reply]
With your updated configuration, can you send me an updated PCAP?

**Reply by alifgufron** [reply]
Oke Vincent, I have resent the latest PCAP file.
