### DISCUSSION TITLE
Not getting Data

### DISCUSSION THREAD

**Discussion by 404invalid-user** [akvorado/akvorado#2099] [Q&A]
i have setup an instance but i keep getting these snmp errors in the console
```
akvorado-outlet-1           | {"level":"error","error":"request timeout (after 1 retries)","exporter":"192.168.10.240","time":"2025-11-13T21:06:42Z","caller":"akvorado/outlet/metadata/provider/snmp/poller.go:91","module":"akvorado/outlet/metadata/provider/snmp","message":"unable to GET (5 OIDs)"}
```

following trouble shooting steps everything is fine up until
```bash
root@metrics:/opt/akvorado# nsenter -t $(pgrep -fo "akvorado inlet") -n tcpdump -c3 -pni eth0 port 161
tcpdump: verbose output suppressed, use -v[v]... for full protocol decode
listening on eth0, link-type EN10MB (Ethernet), snapshot length 262144 bytes
 
^C
0 packets captured
0 packets received by filter
0 packets dropped by kernel
root@metrics:/opt/akvorado# curl -s http://127.0.0.1:8080/api/v0/outlet/metrics | grep -P 'akvorado_outlet_clickhouse_(errors|flow)'
# HELP akvorado_outlet_clickhouse_flow_per_batch Number of flow per batch sent to ClickHouse
# TYPE akvorado_outlet_clickhouse_flow_per_batch summary
akvorado_outlet_clickhouse_flow_per_batch{quantile="0.5"} NaN
akvorado_outlet_clickhouse_flow_per_batch{quantile="0.9"} NaN
akvorado_outlet_clickhouse_flow_per_batch{quantile="0.99"} NaN
akvorado_outlet_clickhouse_flow_per_batch_sum 0
akvorado_outlet_clickhouse_flow_per_batch_count 0
root@metrics:/opt/akvorado# 
```

the switch uses snmp v3 so i copied the config from this issue https://github.com/akvorado/akvorado/discussions/1984
this is my full outlet.yaml config
```yaml
---
metadata:
  providers:
    type: snmp
    credentials:
      ::/0:
        user-name: invaliduser
        authentication-protocol: SHA
        authentication-passphrase: "SECRETA"
        privacy-protocol: AES192
        privacy-passphrase: "SECRETB"
routing:
  provider:
    type: bmp
    # Before increasing this value, look for it in the troubleshooting section
    # of the documentation.
    receive-buffer: 212992
core:
  exporter-classifiers:
    # This is an example. This should be customized depending on how
    # your exporters are named.
    - ClassifySiteRegex(Exporter.Name, "^([^-]+)-", "$1")
    - ClassifyRegion("europe")
    - ClassifyTenant("acme")
    - ClassifyRole("edge")
  interface-classifiers:
    # This is an example. This must be customized depending on the
    # descriptions of your interfaces. In the following, we assume
    # external interfaces are named "Transit: Cogent" Or "IX:
    # FranceIX".
    - |
      ClassifyConnectivityRegex(Interface.Description, "^(?i)(transit|pni|ppni|ix):? ", "$1") &&
      ClassifyProviderRegex(Interface.Description, "^\\S+?\\s(\\S+)", "$1") &&
      ClassifyExternal()
    - ClassifyInternal()
    ```
i do connect to the switch at over tailscale running on the "router" i can ping it on the vm running docker just fine

**Comment by vincentbernat** [comment]
The tcpdump command is incorrect. I'll fix it in the documentation shortly. Try:
```
nsenter -t $(pgrep -fo "akvorado outlet") -n tcpdump -c3 -pni eth0 port 161
```

**Comment by 404invalid-user** [comment]
ahh i though it was strange the outlet logs the error but that was listening on the inlet 
```
root@metrics:/opt/akvorado# nsenter -t $(pgrep -fo "akvorado outlet") -n tcpdump -c3 -pni eth0 port 161
tcpdump: verbose output suppressed, use -v[v]... for full protocol decode
listening on eth0, link-type EN10MB (Ethernet), snapshot length 262144 bytes
15:42:36.423613 IP 247.16.14.5.52077 > 192.168.10.240.161:  F=r U="" E= C="" GetRequest(14) 
15:42:36.436845 IP 192.168.10.240.161 > 247.16.14.5.52077:  F= U="" E=_f5_71_7f_98_5d_82_36_5c_e5_00 C="" Report(33)  .1.3.6.1.6.3.15.1.1.4.0=177124
15:42:36.436968 IP 247.16.14.5.52077 > 192.168.10.240.161:  F=apr U="invaliduser" [!scoped PDU]f9_2b_f0_bb_99_4a_5e_98_8b_a7_b1_d9_dc_fc_36_11_29_f2_ae_c7_90_d4_ca_b9_a4_c0_a2_a9_9f_05_0a_14_26_5f_9e_28_96_2a_3b_2a_37_1e_32_8e_2d_62_ad_1b_76_e9_12_af_15_4f_da_f7_27_53_cf_8a_17_ef_65_e6_d0_bd_76_0f_9c_64_a6_b8_50_de_25_c7_3d_2e_8a_67_e6_bb_19_ef_6f_af_27_16_31_48_c2_14_6c_d3_f1_ca_31_43_03_08_eb_bf_27_69_79_22_11_87_5d_21_b2_67_a9_79_18_29_5b_d4_ff_ee_df
3 packets captured
3 packets received by filter
0 packets dropped by kernel
```

im getting a packets now

**Reply by vincentbernat** [reply]
Use `-c5` to get a bit more packets and check if you get an answer.

**Reply by 404invalid-user** [reply]
```
root@metrics:/opt/akvorado# nsenter -t $(pgrep -fo "akvorado outlet") -n tcpdump -c5 -pni eth0 port 161
tcpdump: verbose output suppressed, use -v[v]... for full protocol decode
listening on eth0, link-type EN10MB (Ethernet), snapshot length 262144 bytes
16:04:21.247226 IP 247.16.14.5.38226 > 192.168.10.240.161:  F=r U="" E= C="" GetRequest(14) 
16:04:21.260792 IP 192.168.10.240.161 > 247.16.14.5.38226:  F= U="" E=_f5_71_7f_98_5d_82_36_5c_e5_00 C="" Report(33)  .1.3.6.1.6.3.15.1.1.4.0=180117
16:04:21.260923 IP 247.16.14.5.38226 > 192.168.10.240.161:  F=apr U="invaliduser" [!scoped PDU]64_2f_38_a8_05_c9_24_95_45_cc_a0_d0_90_92_90_71_6e_f8_cc_1b_96_d6_26_6a_0a_f1_20_7c_38_78_a2_37_74_9f_20_67_c8_f6_39_a3_b3_e9_69_5e_26_9d_0e_63_7d_7d_cf_74_de_94_c9_c5_97_70_e0_2a_f0_90_41_df_6b_b1_f6_48_11_e7_40_85_9b_d7_26_a8_68_f8_7b_1b_1d_0d_97_de_be_ea_55_86_ed_3e_ef_b5_46_0e_d6_c0_fa_e2_0d_0d_f0_65_e8_db_96_7a_70_b0_41_d7_d4_c3_27_45_96_c5_bb_79_75_15_b5
16:04:22.261863 IP 247.16.14.5.38226 > 192.168.10.240.161:  F=apr U="invaliduser" [!scoped PDU]6f_99_db_fc_38_fa_0e_69_8e_60_a4_a2_2e_c9_e1_ad_78_6b_e7_ee_03_cd_32_82_80_cc_0d_47_e5_a6_5b_3d_76_a1_8b_f5_2c_28_0e_2c_d3_68_7c_3c_2a_2b_db_e0_0a_9a_98_d9_7d_9d_63_65_ac_c6_eb_c3_1a_d5_1f_f4_86_90_a6_2a_c5_bc_a1_1f_c2_be_ad_b1_eb_d4_45_18_40_e8_3f_81_09_5f_d0_43_07_cc_ee_e9_6d_2a_f3_06_7c_13_53_41_d8_48_b7_ac_62_5d_d1_9c_a2_a8_c6_da_58_3f_34_0e_da_62_a4_28_5c
16:05:23.357513 IP 247.16.14.5.40932 > 192.168.10.240.161:  F=r U="" E= C="" GetRequest(14) 
5 packets captured
7 packets received by filter
0 packets dropped by kernel
```

**Reply by vincentbernat** [reply]
Increase it a bit more, but it looks like the remote end does not want to answer. Either the SNMP settings are incorrect or the IP address of Akvorado is not whitelisted.

**Reply by 404invalid-user** [reply]
i can connect just fine on the host vm using snmpwalk so this isn't a whitelist or snmp issue. maybe its the config the docs say ::/0 is the default but thats an ipv6 default route not ipv4?

**Reply by vincentbernat** [reply]
Internally, everything is IPv6, so that's OK. And you can see it works as we see `invaliduser` in tcpdump. Maybe you can try AES192-C instead of AES192.

**Reply by 404invalid-user** [reply]
fixed it by setting it to AES but i also had to specify the ip then because it stopped using those credentials.

**Comment by 404invalid-user** [comment]
i do have an issue still though where min max avg dont match up to whats in librenms and it looks like it just isn't logging outbound data
